name,description,image,release_date,popularity,tags
Mission: Impossible III,|Retired from active duty to train new IMF agents, Ethan Hunt is called back into action to confront sadistic arms dealer Owen Davian. Hunt must try to protect his girlfriend while working with his new team to complete the mission.|,/qjy8ABAbWooV4jLG6UjzDHlv4RB.jpg,2006-05-04,4.227248,Adventure,Action,Thriller
The Amazing Spider-Man,|Peter Parker is an outcast high schooler was abandoned by his parents as a boy, leaving him to be raised by his Uncle Ben and Aunt May. Like most teenagers, Peter is trying to figure out who he is and how he got to be the person he is today. As Peter discovers a mysterious briefcase that belonged to his father, he begins a quest to understand his parents' disappearance—leading him directly to Oscorp and the lab of Dr. Curt Connors, his father's former partner. As Spider-Man is set on a collision course with Connors' alter ego, The Lizard, Peter will make life-altering choices to use his powers and shape his destiny to become a hero.|,/eA2D86Y6VPWuUzZyatiLBwpTilQ.jpg,2012-07-04,4.216035,Action,Adventure,Fantasy
The Judge,|A successful lawyer returns to his hometown for his mother's funeral only to discover that his estranged father, the town's judge, is suspected of murder.|,/v6s65U6qisvxWgO3cNnreaaaite.jpg,2014-10-10,4.203148,Drama
Focus,|A veteran grifter takes a young, attractive woman under his wing, but things get complicated when they become romantically involved.|,/9IElGiLkxPLUWZ3avy31bNSG3Tq.jpg,2015-02-27,4.199603,Romance,Comedy,Crime,Drama
Halo: The Fall of Reach,|Relive the origin of the legendary Master Chief and the Spartan program in this three-part animated adaptation of one of Halo's most beloved stories. Kidnapped as children and conscripted into a brutal military training and augmentation program, the Spartans were designed to be the ultimate weapon against chaos and insurgency - but when a dangerous alien alliance known as the Covenant declares war on humanity, the Spartans might be our only hope.|,/9FvhU9j2uqiNUmtjqeN5dtD0apf.jpg,2015-10-27,4.185675,Action,Animation,Science Fiction
Mr. Holmes,|The story is set in 1947, following a long-retired Holmes living in a Sussex village with his housekeeper and rising detective son. But then he finds himself haunted by an unsolved 50-year old case. Holmes' memory isn't what it used to be, so he only remembers fragments of the case: a confrontation with an angry husband, a secret bond with his beautiful but unstable wife.|,/9v25BUcPSxRS3yJ2yd3GHZOtoS8.jpg,2015-07-17,4.166834,Mystery,Crime,Drama
Batman Begins,|Driven by tragedy, billionaire Bruce Wayne dedicates his life to uncovering and defeating the corruption that plagues his home, Gotham City.  Unable to work within the system, he instead creates a new identity, a symbol of fear for the criminal underworld - The Batman.|,/mYsoCOq82b08juHGxd3WnotiCAh.jpg,2005-06-15,4.145477,Action,Crime,Drama
Forrest Gump,|A man with a low IQ has accomplished great things in his life and been present during significant historic events - in each case, far exceeding what anyone imagined he could do. Yet, despite all the things he has attained, his one true love eludes him. 'Forrest Gump' is the story of a man who rose above his challenges, and who proved that determination, courage, and love are more important than ability.|,/z4ROnCrL77ZMzT0MsNXY5j25wS2.jpg,1994-06-22,4.107396,Comedy,Drama,Romance
The Hobbit: An Unexpected Journey,|Bilbo Baggins, a hobbit enjoying his quiet life, is swept into an epic quest by Gandalf the Grey and thirteen dwarves who seek to reclaim their mountain home from Smaug, the dragon.|,/w29Guo6FX6fxzH86f8iAbEhQEFC.jpg,2012-12-14,4.104164,Adventure,Fantasy,Action
Man of Steel,|A young boy learns that he has extraordinary powers and is not of this earth. As a young man, he journeys to discover where he came from and what he was sent here to do. But the hero in him must emerge if he is to save the world from annihilation and become the symbol of hope for all mankind.|,/xWlaTLnD8NJMTT9PGOD9z5re1SL.jpg,2013-06-14,4.056869,Action,Adventure,Fantasy,Science Fiction
Back to the Future,|Eighties teenager Marty McFly is accidentally sent back in time to 1955, inadvertently disrupting his parents' first meeting and attracting his mother's romantic interest. Marty must repair the damage to history by rekindling his parents' romance and - with the help of his eccentric inventor friend Doc Brown - return to 1985.|,/pTpxQB1N0waaSc3OSn0e9oc8kx9.jpg,1985-07-03,4.051615,Adventure,Comedy,Science Fiction,Family
Transformers: Age of Extinction,|As humanity picks up the pieces, following the conclusion of "Transformers: Dark of the Moon," Autobots and Decepticons have all but vanished from the face of the planet. However, a group of powerful, ingenious businessman and scientists attempt to learn from past Transformer incursions and push the boundaries of technology beyond what they can control - all while an ancient, powerful Transformer menace sets Earth in his cross-hairs.|,/6rtXH8cIZbgwLy8EvaXGucwdep5.jpg,2014-06-27,4.051223,Science Fiction,Action,Adventure
Harry Potter and the Philosopher's Stone,|Harry Potter has lived under the stairs at his aunt and uncle's house his whole life. But on his 11th birthday, he learns he's a powerful wizard -- with a place waiting for him at the Hogwarts School of Witchcraft and Wizardry. As he learns to harness his newfound powers with the help of the school's kindly headmaster, Harry uncovers the truth about his parents' deaths -- and about the villain who's to blame.|,/dCtFvscYcXQKTNvyyaQr2g2UacJ.jpg,2001-11-04,4.04375,Adventure,Fantasy,Family
The Hunger Games,|Every year in the ruins of what was once North America, the nation of Panem forces each of its twelve districts to send a teenage boy and girl to compete in the Hunger Games.  Part twisted entertainment, part government intimidation tactic, the Hunger Games are a nationally televised event in which “Tributes” must fight with one another until one survivor remains.  Pitted against highly-trained Tributes who have prepared for these Games their entire lives, Katniss is forced to rely upon her sharp instincts as well as the mentorship of drunken former victor Haymitch Abernathy.  If she’s ever to return home to District 12, Katniss must make impossible choices in the arena that weigh survival against humanity and life against love. The world will be watching.|,/iLJdwmzrHFjFwI5lvYAT1gcpRuA.jpg,2012-03-12,4.034433,Science Fiction,Adventure,Fantasy
Monsters University,A look at the relationship between Mike and Sulley during their days at Monsters University — when they weren't necessarily the best of friends.,/a05xQU9huY3P5uurLcGGHmsf2Vh.jpg,2013-06-21,4.022031,Family,Animation
Paul Blart: Mall Cop 2,|Security guard Paul Blart is headed to Las Vegas to attend a Security Guard Expo with his teenage daughter Maya before she departs for college. While at the convention, he inadvertently discovers a heist - and it's up to Blart to apprehend the criminals.|,/618jhN1vEFHkA3MBrURuBZ7SuID.jpg,2015-04-17,4.003951,Family,Comedy,Action,Adventure
Despicable Me 2,Gru is recruited by the Anti-Villain League to help deal with a powerful new super criminal.,/ek09KXB8ytg9nUb3hDUpJn7APdT.jpg,2013-07-03,4.000533,Animation,Comedy,Family
Mission: Impossible,|When Ethan Hunt, the leader of a crack espionage team whose perilous operation has gone awry with no explanation, discovers that a mole has penetrated the CIA, he's surprised to learn that he's the No. 1 suspect. To clear his name, Hunt now must ferret out the real double agent and, in the process, even the score.|,/1PVKS17pIBFsIhgFws2uagPDNLW.jpg,1996-05-21,3.993779,Adventure,Action,Thriller
Skyfall,|When Bond's latest assignment goes gravely wrong and agents around the world are exposed, MI6 is attacked forcing M to relocate the agency. These events cause her authority and position to be challenged by Gareth Mallory (Ralph Fiennes), the new Chairman of the Intelligence and Security Committee. With MI6 now compromised from both inside and out, M is left with one ally she can trust: Bond. 007 takes to the shadows - aided only by field agent, Eve (Naomie Harris) - following a trail to the mysterious Silva (Javier Bardem), whose lethal and hidden motives have yet to reveal themselves.|,/uVALAeLEMGMf3oYpvdVi4uuaNOo.jpg,2012-11-09,3.983078,Action,Adventure,Thriller
Sicario,|A young female FBI agent joins a secret CIA operation to take down a Mexican cartel boss, a job that ends up pushing her ethical and moral values to the limit.|,/p2SdfGmQRaw8xhFbexlHL7srMM8.jpg,2015-09-18,3.980116,Mystery,Crime,Drama
Star Wars: Episode II - Attack of the Clones,|Ten years after the invasion of Naboo, the galaxy is on the brink of civil war. Under the leadership of a renegade Jedi named Count Dooku, thousands of solar systems threaten to break away from the Galactic Republic. When an assassination attempt is made on Senator Padmé Amidala, the former Queen of Naboo, twenty-year-old Jedi apprentice Anakin Skywalker is assigned to protect her. In the course of his mission, Anakin discovers his love for Padmé as well as his own darker side. Soon, Anakin, Padmé, and Obi-Wan Kenobi are drawn into the heart of the Separatist movement and the beginning of the Clone Wars.|,/2vcNFtrZXNwIcBgH5e2xXCmVR8t.jpg,2002-05-16,3.937281,Adventure,Action,Science Fiction
The Shawshank Redemption,|Framed in the 1940s for the double murder of his wife and her lover, upstanding banker Andy Dufresne begins a new life at the Shawshank prison, where he puts his accounting skills to work for an amoral warden. During his long stretch in prison, Dufresne comes to be admired by the other inmates -- including an older prisoner named Red -- for his integrity and unquenchable sense of hope.|,/9O7gLzmreU0nGkIB6K3BsJbzvNv.jpg,1994-09-14,3.874985,Drama,Crime
Green Lantern,|For centuries, a small but powerful force of warriors called the Green Lantern Corps has sworn to keep intergalactic order. Each Green Lantern wears a ring that grants him superpowers. But when a new enemy called Parallax threatens to destroy the balance of power in the Universe, their fate and the fate of Earth lie in the hands of the first human ever recruited.|,/zUSEYp9G7Hk9GZIfbPoOiSHvwHV.jpg,2011-06-16,3.873835,Adventure,Action,Thriller,Science Fiction
The Wolf of Wall Street,|A New York stockbroker refuses to cooperate in a large securities fraud case involving corruption on Wall Street, corporate banking world and mob infiltration. Based on Jordan Belfort's autobiography.|,/wAgdJRx4uZ0u4uzu34NOMvtjLAR.jpg,2013-12-25,3.867615,Crime,Drama,Comedy
Hotel Transylvania,|Dracula, who operates a high-end resort away from the human world, goes into overprotective mode when a boy discovers the resort and falls for the count's teen-aged daughter.|,/9qugesYpAWHUpdrw2w8URSGkAPt.jpg,2012-09-27,3.865973,Animation,Comedy,Family,Fantasy
Edge of Tomorrow,|Major Bill Cage is an officer who has never seen a day of combat when he is unceremoniously demoted and dropped into combat. Cage is killed within minutes, managing to take an alpha alien down with him. He awakens back at the beginning of the same day and is forced to fight and die again... and again - as physical contact with the alien has thrown him into a time loop.|,/tpoVEYvm6qcXueZrQYJNRLXL88s.jpg,2014-06-06,3.850508,Action,Science Fiction
Scarface,|After getting a green card in exchange for assassinating a Cuban government official, Tony Montana stakes a claim on the drug trade in Miami. Viciously murdering anyone who stands in his way, Tony eventually becomes the biggest drug lord in the state, controlling nearly all the cocaine that comes through Miami. But increased pressure from the police, wars with Colombian drug cartels and his own drug-fueled paranoia serve to fuel the flames of his eventual downfall.|,/zr2p353wrd6j3wjLgDT4TcaestB.jpg,1983-12-08,3.832571,Action,Adventure,Crime,Drama,Thriller
Alien,|During its return to the earth, commercial spaceship Nostromo intercepts a distress signal from a distant planet. When a three-member team of the crew discovers a chamber containing thousands of eggs on the planet, a creature inside one of the eggs attacks an explorer. The entire crew is unaware of the impending nightmare set to descend upon them when the alien parasite planted inside its unfortunate host is birthed.|,/uU9R1byS3USozpzWJ5oz7YAkXyk.jpg,1979-05-25,3.809263,Horror,Action,Thriller,Science Fiction
Léon,|Leon, the top hit man in New York, has earned a rep as an effective "cleaner". But when his next-door neighbors are wiped out by a loose-cannon DEA agent, he becomes the unwilling custodian of 12-year-old Mathilda. Before long, Mathilda's thoughts turn to revenge, and she considers following in Leon's footsteps.|,/gE8S02QUOhVnAmYu4tcrBlMTujz.jpg,1994-09-14,3.799343,Thriller,Crime,Drama
Before I Go to Sleep,|A woman wakes up every day, remembering nothing as a result of a traumatic accident in her past. One day, new terrifying truths emerge that force her to question everyone around her.|,/3UG2Pb122c7Va8MBtr1OHRB1YPh.jpg,2014-10-31,3.787368,Mystery,Thriller
Fifty Shades of Grey,|When college senior Anastasia Steele steps in for her sick roommate to interview prominent businessman Christian Grey for their campus paper, little does she realize the path her life will take. Christian, as enigmatic as he is rich and powerful, finds himself strangely drawn to Ana, and she to him. Though sexually inexperienced, Ana plunges headlong into an affair -- and learns that Christian's true sexual proclivities push the boundaries of pain and pleasure.|,/jV8wnk3Jgz6f7degmT3lHNGI2tK.jpg,2015-02-13,3.780091,Romance,Drama
American Ultra,|American Ultra is a fast-paced action comedy about Mike, a seemingly hapless and unmotivated stoner whose small-town life with his live-in girlfriend, Phoebe, is suddenly turned upside down.  Unbeknownst to him, Mike is actually a highly trained, lethal sleeper agent. In the blink of an eye, as his secret past comes back to haunt him, Mike is thrust into the middle of a deadly government operation and is forced to summon his inner action-hero in order to survive.|,/auQHgr1FO6upJpXx1eYEeyq2sMs.jpg,2015-08-21,3.773735,Comedy,Action
The Grand Budapest Hotel,|The Grand Budapest Hotel tells of a legendary concierge at a famous European hotel between the wars and his friendship with a young employee who becomes his trusted protégé. The story involves the theft and recovery of a priceless Renaissance painting, the battle for an enormous family fortune and the slow and then sudden upheavals that transformed Europe during the first half of the 20th century.|,/nX5XotM9yprCKarRH4fzOq1VM1J.jpg,2014-03-07,3.74649,Comedy,Drama
Dumb and Dumber To,|20 years after the dimwits set out on their first adventure, they head out in search of one of their long lost children in the hope of gaining a new kidney.|,/Ekw3ijq9L6RiKvv5m2tPOEklHF.jpg,2014-11-14,3.74368,Comedy
Wild Card,|When a Las Vegas bodyguard with lethal skills and a gambling problem gets in trouble with the mob, he has one last play… and it's all or nothing.|,/cZMjg5fWkhJ1D7MouzZuiB16Hdk.jpg,2015-01-30,3.71445,Thriller,Crime,Drama
Let's Be Cops,|It's the ultimate buddy cop movie except for one thing: they're not cops.  When two struggling pals dress as police officers for a costume party, they become neighborhood sensations.  But when these newly-minted “heroes” get tangled in a real life web of mobsters and dirty detectives, they must put their fake badges on the line.|,/8GVU8AaYpxiIS462SZgAtjh02pm.jpg,2014-08-13,3.701504,Comedy
Dawn of the Planet of the Apes,|A group of scientists in San Francisco struggle to stay alive in the aftermath of a plague that is wiping out humanity, while Caesar tries to maintain dominance over his community of intelligent apes.|,/2EUAUIu5lHFlkj5FRryohlH6CRO.jpg,2014-07-11,3.689406,Science Fiction,Action,Drama,Thriller
Despicable Me,|In a happy suburban neighbourhood surrounded by white picket fences with flowering rose bushes, sits a black house with a dead lawn. Unbeknownst to the neighbours, hidden deep beneath this home is a vast secret hideout. Surrounded by an army of tireless, little yellow minions, we discover Gru, planning the biggest heist in the history of the world. He is going to steal the moon (Yes, the moon!) to prove to his Mum that he is better than the other super-villains, especially the new kid on the block, Vector. Gru delights in all things wicked. Armed with his arsenal of shrink rays, freeze guns and battle-ready vehicles for land and air, he vanquishes all who stand in his way. Until the day he encounters the immense will of three little orphaned girls who look at him and see something that no one else has ever seen: a potential dad.|,/4zHJhBSY4kNZXfhTlmy2TzXD51M.jpg,2010-07-09,3.664817,Animation,Family
The Gambler,Literature professor and gambler Jim Bennett's debt causes him to borrow money from his mother and a loan shark. Further complicating his situation is his relationship with one of his students. Will Bennett risk his life for a second chance?,/sB03tHmWpIU9oKo4axwOJUf57qV.jpg,2014-12-25,3.655414,Thriller,Crime,Drama
Nackt unter Wölfen,|Naked Among Wolves (German: Nackt unter Wölfen) is a German drama film directed by Philipp Kadelbach in 2015. It is based on the novel of the same name by Bruno Apitz, which was published in 1958 by the East German Publishing house. It was created for television, it is the third film version of the literary text. The film takes place in the years 1944 and 1945 towards the end of World War II in the Buchenwald concentration camp.|,/daEWegR9Vm3LnLfEeOo0uh7zoUf.jpg,2015-04-01,3.648721,War,Drama,History
Blade Runner,|In the smog-choked dystopian Los Angeles of 2019, blade runner Rick Deckard is called out of retirement to kill a quartet of replicants who have escaped to Earth seeking their creator for a way to extend their short life spans.|,/5ig0kdWz5kxR4PHjyCgyI5khCzd.jpg,1982-06-25,3.643576,Science Fiction,Drama,Thriller
Iron Man 2,|With the world now aware of his dual life as the armored superhero Iron Man, billionaire inventor Tony Stark faces pressure from the government, the press, and the public to share his technology with the military. Unwilling to let go of his invention, Stark, along with Pepper Potts, and James "Rhodey" Rhodes at his side, must forge new alliances - and confront powerful enemies.|,/zJ2eK7fehqFSQ2w5JlQIF0OJP9q.jpg,2010-05-07,3.638089,Adventure,Action,Science Fiction
Sherlock Holmes,Eccentric consulting detective Sherlock Holmes and Doctor John Watson battle to bring down a new nemesis and unravel a deadly plot that could destroy England.,/22ngurXbLqab7Sko6aTSdwOCe5W.jpg,2009-12-25,3.603829,Adventure,Drama,Action,Comedy,Thriller,Crime,Mystery
Elf,|When young Buddy falls into Santa's gift sack on Christmas Eve, he's transported back to the North Pole and raised as a toy-making elf by Santa's helpers. But as he grows into adulthood, he can't shake the nagging feeling that he doesn't belong. Buddy vows to visit Manhattan and find his real dad, a workaholic publisher.|,/9jChHqqcpe0zHNTqkNqWZkwkgil.jpg,2003-10-09,3.60231,Romance,Comedy,Family,Fantasy
The Sixth Sense,|A psychological thriller about an eight year old boy named Cole Sear who believes he can see into the world of the dead. A child psychologist named Malcolm Crowe comes to Cole to help him deal with his problem, learning that he really can see ghosts of dead people.|,/wW1y9pvMejWjdfz0mpbB3Ag3SJf.jpg,1999-08-02,3.589428,Mystery,Thriller,Drama
The World's End,Five friends who reunite in an attempt to top their epic pub crawl from 20 years earlier unwittingly become humankind's only hope for survival.,/7xZUJMqGBLvhPJqn23UM3yUC5k5.jpg,2013-07-19,3.573411,Comedy,Action,Science Fiction
The Hobbit: The Desolation of Smaug,|The Dwarves, Bilbo and Gandalf have successfully escaped the Misty Mountains, and Bilbo has gained the One Ring. They all continue their journey to get their gold back from the Dragon, Smaug.|,/gQCiuxGsfiXH1su6lp9n0nd0UeH.jpg,2013-12-13,3.570867,Adventure,Fantasy
Quantum of Solace,|Quantum of Solace continues the adventures of James Bond after Casino Royale. Betrayed by Vesper, the woman he loved, 007 fights the urge to make his latest mission personal. Pursuing his determination to uncover the truth, Bond and M interrogate Mr. White, who reveals that the organization that blackmailed Vesper is far more complex and dangerous than anyone had imagined.|,/6mlNx0Jiqhg3D7NlANT9pidsgPJ.jpg,2008-10-30,3.552844,Adventure,Action,Thriller,Crime
Ice Age,|With the impending ice age almost upon them, a mismatched trio of prehistoric critters -- Manny the woolly mammoth, Diego the saber-toothed tiger and Sid the giant sloth -- find an orphaned infant and decide to return it to its human parents. Along the way, the unlikely allies become friends. But when enemies attack, their quest takes on far nobler aims..|,/zpaQwR0YViPd83bx1e559QyZ35i.jpg,2002-03-15,3.548701,Animation,Comedy,Family,Adventure
The Lord of the Rings: The Two Towers,|Frodo and Sam are trekking to Mordor to destroy the One Ring of Power while Gimli, Legolas and Aragorn search for the orc-captured Merry and Pippin. All along, nefarious wizard Saruman awaits the Fellowship members at the Orthanc Tower in Isengard.|,/5o5fv1dHG7vWoH2hmqwihVPBoBm.jpg,2002-12-18,3.546255,Adventure,Fantasy,Action
Ice Age: The Meltdown,|Diego, Manny and Sid return in this sequel to the hit animated movie Ice Age. This time around, the deep freeze is over, and the ice-covered earth is starting to melt, which will destroy the trio's cherished valley. The impending disaster prompts them to reunite and warn all the other beasts about the desperate situation.|,/8aAgdxnrsiI74cPcSkbswGXxnxy.jpg,2006-03-23,3.540231,Animation,Family,Comedy,Adventure
Survivor,|A Foreign Service Officer in London tries to prevent a terrorist attack set to hit New York, but is forced to go on the run when she is framed for crimes she did not commit.|,/XtvR1aSph7X3wqrE2PY66IPzVi.jpg,2015-05-29,3.525099,Crime,Thriller,Action
Die Hard,|NYPD cop John McClane's plan to reconcile with his estranged wife, Holly, is thrown for a serious loop when minutes after he arrives at her office, the entire building is overtaken by a group of pitiless terrorists. With little help from the LAPD, wisecracking McClane sets out to single-handedly rescue the hostages and bring the bad guys down.|,/rwBUbQ15vIBa6sb1xCBgGXcXCO7.jpg,1988-07-14,3.516718,Action,Thriller
Pulp Fiction,|A burger-loving hit man, his philosophical partner, a drug-addled gangster's moll and a washed-up boxer converge in this sprawling, comedic crime caper. Their adventures unfurl in three stories that ingeniously trip back and forth in time.|,/dM2w364MScsjFf8pfMbaWUcWrR.jpg,1994-10-14,3.50717,Thriller,Crime
Divergent,|DIVERGENT is a thrilling action-adventure film set in a world where people are divided into distinct factions based on human virtues. Tris Prior is warned she is Divergent and will never fit into any one group. When she discovers a conspiracy by a faction leader to destroy all Divergents, Tris must learn to trust in the mysterious Four and together they must find out what makes being Divergent so dangerous before it's too late. Based on the best-selling book series by Veronica Roth.|,/yTtx2ciqk4XdN1oKhMMDy3f5ue3.jpg,2014-03-21,3.499812,Science Fiction,Action
12 Years a Slave,|In the pre-Civil War United States, Solomon Northup, a free black man from upstate New York, is abducted and sold into slavery. Facing cruelty as well as unexpected kindnesses Solomon struggles not only to stay alive, but to retain his dignity. In the twelfth year of his unforgettable odyssey, Solomon’s chance meeting with a Canadian abolitionist will forever alter his life.|,/kb3X943WMIJYVg4SOAyK0pmWL5D.jpg,2013-10-30,3.483988,Drama,History
Star Trek,|The fate of the galaxy rests in the hands of bitter rivals. One, James Kirk, is a delinquent, thrill-seeking Iowa farm boy. The other, Spock, a Vulcan, was raised in a logic-based society that rejects all emotion. As fiery instinct clashes with calm reason, their unlikely but powerful partnership is the only thing capable of leading their crew through unimaginable danger, boldly going where no one has gone before. The human adventure has begun again.|,/xPihqTMhCh6b8DHYzE61jrIiNMS.jpg,2009-05-07,3.483225,Science Fiction,Action,Adventure
A Very Murray Christmas,|Bill Murray worries no one will show up to his TV show due to a massive snowstorm in New York City. Through luck and perseverance, guests arrive at Gotham’s Carlyle Hotel to help him — dancing and singing in holiday spirit.|,/3CMBgEte4pEapn2deugsfz2hjAL.jpg,2015-12-04,3.471495,Comedy,Music
Pirates of the Caribbean: The Curse of the Black Pearl,|Jack Sparrow, a freewheeling 17th-century pirate who roams the Caribbean Sea butts heads with a rival pirate bent on pillaging the village of Port Royal. When the governor's daughter is kidnapped, Sparrow decides to help the girl's love save her. But their seafaring mission is hardly simple.|,/tkt9xR1kNX5R9rCebASKck44si2.jpg,2003-07-09,3.464743,Adventure,Fantasy,Action
X-Men: Apocalypse,|One of the most powerful super villains, Apocalypse emerges and threatens to destroy the planet and its up to the X-men to stop him, with help from some of their old foes.|,/d4YarHtXv2r3z3PbCYbaVF2PJ9s.jpg,2016-05-27,3.458192,Action,Adventure,Science Fiction,Fantasy
