name,description,image,release_date,popularity,tags
The Amazing Spider-Man,|Peter Parker is an outcast high schooler was abandoned by his parents as a boy, leaving him to be raised by his Uncle Ben and Aunt May. Like most teenagers, Peter is trying to figure out who he is and how he got to be the person he is today. As Peter discovers a mysterious briefcase that belonged to his father, he begins a quest to understand his parents' disappearance—leading him directly to Oscorp and the lab of Dr. Curt Connors, his father's former partner. As Spider-Man is set on a collision course with Connors' alter ego, The Lizard, Peter will make life-altering choices to use his powers and shape his destiny to become a hero.|,/AtFhFTNbNo49qn7fkbo9lDtRkeR.jpg,2012-07-04,3.32332993944509,Action,Adventure,Fantasy
Blackhat,A man is released from prison to help American and Chinese authorities pursue a mysterious cyber criminal. The dangerous search leads them from Chicago to Hong Kong.,/tn07zjNNIJuOsecqTC2JEYA49uU.jpg,2015-01-16,4.16104075774355,Action,Crime,Thriller
Looper,|In the futuristic action thriller Looper, time travel will be invented but it will be illegal and only available on the black market. When the mob wants to get rid of someone, they will send their target 30 years into the past where a looper, a hired gun, like Joe is waiting to mop up. Joe is getting rich and life is good until the day the mob decides to close the loop, sending back Joe's future self for assassination.|,/lbEqxVbzg936a392Z837HTUGvWc.jpg,2012-09-28,3.29911053345653,Action,Science Fiction,Thriller
Terminator Salvation,|All grown up in post-apocalyptic 2018, John Connor must lead the resistance of humans against the increasingly dominating militaristic robots. But when Marcus Wright appears, his existence confuses the mission as Connor tries to determine whether Wright has come from the future or the past -- and whether he's friend or foe.|,/hxDfhavtxA2Ayx7O9BsQMcZRdG0.jpg,2009-05-20,3.29289164571635,Action,Drama,Science Fiction,Thriller
Shutter Island,|World War II soldier-turned-U.S. marshal Teddy Daniels investigates the disappearance of a patient from a hospital for the criminally insane, but his efforts are compromised by his own troubling visions and by Dr. Cawley.|,/aZqKsvpJDFy2UzUMsdskNFbfkOd.jpg,2010-02-18,3.12729643281101,Drama,Mystery,Thriller
Son of a Gun,|Locked up for a minor crime, 19 year old JR quickly learns the harsh realities of prison life. Protection, if you can get it, is paramount. JR soon finds himself under the watchful eye of Australia's most notorious criminal, Brendan Lynch, but protection comes at a price.|,/pJoofuXXnEsDu5U4L1L48qkgUPf.jpg,2014-10-16,3.24448400042806,Action,Crime,Drama
The Last 5 Years,|Based on the acclaimed musical written by the Tony award winning composer and lyricist Jason Robert Brown, The Last 5 Years is an intersecting story of a relationship between a struggling actress and her novelist lover as each of them illustrate the struggle and deconstruction of their love affair.|,/5ZVsMEDswVsJB4MviX9Yp43Nw4I.jpg,2015-02-13,3.24098642475088,Comedy,Drama,Music,Romance
Total Recall,|Welcome to Rekall, the company that can turn your dreams into real memories. For a factory worker named Douglas Quaid, even though he's got a beautiful wife who he loves, the mind-trip sounds like the perfect vacation from his frustrating life - real memories of life as a super-spy might be just what he needs. But when the procedure goes horribly wrong, Quaid becomes a hunted man. Finding himself on the run from the police - controlled by Chancellor Cohaagen, the leader of the free world - Quaid teams up with a rebel fighter to find the head of the underground resistance and stop Cohaagen. The line between fantasy and reality gets blurred and the fate of his world hangs in the balance as Quaid discovers his true identity, his true love, and his true fate.|,/tWBo7aZk3I1dLxmMj7ZJcN8uke5.jpg,2012-08-03,3.24078567054769,Action,Adventure,Science Fiction,Thriller
The Lego Movie,|An ordinary Lego mini-figure, mistakenly thought to be the extraordinary MasterBuilder, is recruited to join a quest to stop an evil Lego tyrant from gluing the universe together.|,/lMHbadNmznKs5vgBAkHxKGHulOa.jpg,2014-02-07,3.23050897085837,Action,Adventure,Animation,Comedy,Fantasy,Family
Godzilla,|Fifteen years after an 'incident' at a Japanese nuclear power plant, physicist Joe Brody joins forces with his soldier son Ford to discover for themselves what really happened.  What they uncover is prelude to global-threatening devastation.  An epic rebirth to Toho's iconic Godzilla, this spectacular adventure pits the world's most famous monster against malevolent creatures who, bolstered by humanity's scientific arrogance, threaten our very existence.|,/szVwkB4H5yyOJBVuQ432b9boO0N.jpg,2014-05-16,3.22610238206913,Action,Science Fiction,Thriller
Deadpool,An X-Men spin-off.,/70yzeQUerxKRxeVE61ob9DlDFjv.jpg,2016-02-12,3.21298205462845
Life of Pi,|The story of an Indian boy named Pi, a zookeeper's son who finds himself in the company of a hyena, zebra, orangutan, and a Bengal tiger after a shipwreck sets them adrift in the Pacific Ocean.|,/rXhuBgQyRKB7cW5BRImyVkO89K7.jpg,2012-11-21,3.20436141133219,Action,Adventure,Drama
ใช่รักหรือเปล่า,|The storyline revolves around a group of schoolboys who suspect two of their number are in love with each other. They come up with ways to prove the secret love affair, but things get more complicated when a girl comes into play.|,/gVxKCRcUpXoMiMpHgixZjSHdwYM.jpg,2014-02-27,3.19171831073182,Comedy,Romance
Anegan,|Anegan is an tamil Romantic movie direction by K V Anand under the banner AGS Entertaintment. The movie starring with Dhanush, Amyra Dastur who debuted in Bollywood with Issaq and Karthil Muthuraman in lead roles. |,/86N5mZXBWXj72YEVAwqV2fKHLdX.jpg,2015-02-13,3.17670321493335,Romance
Noah,A man who suffers visions of an apocalyptic deluge takes measures to protect his family from the coming flood.,/5wioUjzwr91fvq7ydunxK2CPSxi.jpg,2014-03-26,3.17410573065229,Adventure,Drama
Underworld: Rise of the Lycans,|A prequel to the first two Underworld films, this fantasy explains the origins of the feud between the Vampires and the Lycans. Aided by his secret love, Sonja, courageous Lucian leads the Lycans in battle against brutal Vampire king Viktor. Determined to break the king's enslavement of his people, Lucian faces off against the Death Dealer army in a bid for Lycan independence.|,/hZtK6fkusSKzGc0f7yQ2syo14Ze.jpg,2009-01-22,3.16575198517742,Action,Adventure,Fantasy,Science Fiction,Thriller
Man of Steel,|A young boy learns that he has extraordinary powers and is not of this earth. As a young man, he journeys to discover where he came from and what he was sent here to do. But the hero in him must emerge if he is to save the world from annihilation and become the symbol of hope for all mankind.|,/6HQT7R0tiWGxi7CA1zb58j28OTM.jpg,2013-06-14,3.15234347846992,Action,Adventure,Fantasy,Science Fiction
Star Wars: Episode IV - A New Hope,Princess Leia is captured and held hostage by the evil Imperial forces in their effort to take over the galactic Empire. Venturesome Luke Skywalker and dashing captain Han Solo team together with the loveable robot duo R2-D2 and C-3PO to rescue the beautiful princess and restore peace and justice in the Empire.,/tvSlBzAdRE29bZe5yYWrJ2ds137.jpg,1977-05-25,3.1210008139877,Action,Adventure,Science Fiction
|Alexander and the Terrible, Horrible, No Good, Very Bad Day|,|Alexander's day begins with gum stuck in his hair, followed by more calamities. Though he finds little sympathy from his family and begins to wonder if bad things only happen to him, his mom, dad, brother, and sister all find themselves living through their own terrible, horrible, no good, very bad day.|,/yup7xOCpOSHeUyalUH6mpFuBDpG.jpg,2014-10-10,3.11760413420289,Comedy,Family
Nine 1/2 Weeks,|An erotic story about a woman, the assistant of an art gallery, who gets involved in an impersonal affair with a man. She barely knows about his life, only about the sex games they play, so the relationship begins to get complicated.|,/ft0NylB71zkkoEnFalNBBDWTXtS.jpg,1986-02-14,3.1155894872963,Drama,Romance
Titanic,|84 years later, a 101-year-old woman named Rose DeWitt Bukater tells the story to her granddaughter Lizzy Calvert, Brock Lovett, Lewis Bodine, Bobby Buell and Anatoly Mikailavich on the Keldysh about her life set in April 10th 1912, on a ship called Titanic when young Rose boards the departing ship with the upper-class passengers and her mother, Ruth DeWitt Bukater, and her fiancé, Caledon Hockley. Meanwhile, a drifter and artist named Jack Dawson and his best friend Fabrizio De Rossi win third-class tickets to the ship in a game. And she explains the whole story from departure until the death of Titanic on its first and last voyage April 15th, 1912 at 2:20 in the morning.|,/f9iH7Javzxokvnkiz2yHD1dcmUy.jpg,1997-12-19,3.11299783977934,Action,Drama,Romance
The SpongeBob Movie: Sponge Out of Water,|Burger Beard is a pirate who is in search of the final page of a magical book that makes any evil plan he writes in it come true, which happens to be the Krabby Patty secret formula. When the entire city of Bikini Bottom is put in danger, SpongeBob, Patrick, Mr. Krabs, Squidward, Sandy, and Plankton need to go on a quest that takes them to the surface. In order to get back the recipe and save their city, the gang must retrieve the book and transform themselves into superheroes.|,/sZGlB5G7FjGiGwVUusluSb9DdKd.jpg,2015-02-06,4.05918905080665,Adventure,Animation,Comedy
The Lord of the Rings: The Fellowship of the Ring,|Young hobbit Frodo Baggins, after inheriting a mysterious ring from his uncle Bilbo, must leave his home in order to keep it from falling into the hands of its evil creator. Along the way, a fellowship is formed to protect the ringbearer and make sure that the ring arrives at its final destination: Mt. Doom, the only place where it can be destroyed.|,/9HG6pINW1KoFTAKY3LdybkoOKAm.jpg,2001-12-19,3.0878758199312,Action,Adventure,Fantasy
Her,|In the not so distant future, Theodore, a lonely writer purchases a newly developed operating system designed to meet the user's every needs. To Theordore's surprise, a romantic relationship develops between him and his operating system. This unconventional love story blends science fiction and romance in a sweet tale that explores the nature of love and the ways that technology isolates and connects us all.|,/fsoTLnUXEUTNuVCBxAJMY0HPPd.jpg,2013-12-18,3.06313692742252,Drama,Science Fiction,Romance
300: Rise of an Empire,|Based on Frank Miller's latest graphic novel Xerxes and told in the breathtaking visual style of the blockbuster "300," this new chapter of the epic saga takes the action to a fresh battlefield--on the sea--as Greek general Themistokles attempts to unite all of Greece by leading the charge that will change the course of the war. "300: Rise of an Empire" pits Themistokles against the massive invading Persian forces led by mortal-turned-god Xerxes and Artemesia, the vengeful commander of the Persian navy.|,/bRE7nmNuZzciep7MDkNfuTrM9zW.jpg,2014-03-07,3.04788769610423,Action,War
Machete Kills,Ex-Federale agent Machete is recruited by the President of the United States for a mission which would be impossible for any mortal man – he must take down a madman revolutionary and an eccentric billionaire arms dealer who has hatched a plan to spread war and anarchy across the planet.,/ltblMRM8clWKsjC2qQITuRN40Yr.jpg,2013-10-11,3.04234670687331,Action,Crime,Thriller
The Mummy,|Dashing legionnaire Rick O'Connell and Beni, his weasel of a companion, stumble upon the hidden ruins of Hamunaptra while in the midst of a battle in 1923, 3,000 years after Imhotep has suffered a fate worse than death; his body will remain undead for all eternity as a punishment for a forbidden love.|,/cftmDzVCWKynKMfY9oyFj7igFqJ.jpg,1999-05-06,3.03658496693255,Action,Adventure,Fantasy,Horror,Thriller
Raiders of the Lost Ark,|When Dr. Indiana Jones – the tweed-suited professor who just happens to be a celebrated archaeologist – is hired by the government to locate the legendary Ark of the Covenant, he finds himself up against the entire Nazi regime.|,/qB4BK9ddEbuka8G38AlnXBDDwt3.jpg,1981-06-12,3.02138886923458,Action,Adventure
Penguins of Madagascar,|Skipper, Kowalski, Rico and Private join forces with undercover organization The North Wind to stop the villainous Dr. Octavius Brine from destroying the world as we know it.|,/eCdQdoqG9kQQbzPnbVDXqwoTgLl.jpg,2014-11-26,3.0198603305042,Adventure,Animation,Comedy,Family
Ender's Game,|Based on the classic novel by Orson Scott Card, Ender's Game is the story of the Earth's most gifted children training to defend their homeplanet in the space wars of the future.|,/vuZ8uSqyOM5698yNraF7OJRM3mS.jpg,2013-11-01,2.98767819755503,Action,Adventure,Science Fiction
Star Trek Into Darkness,|When the crew of the Enterprise is called back home, they find an unstoppable force of terror from within their own organization has detonated the fleet and everything it stands for, leaving our world in a state of crisis.  With a personal score to settle, Captain Kirk leads a manhunt to a war-zone world to capture a one man weapon of mass destruction. As our heroes are propelled into an epic chess game of life and death, love will be challenged, friendships will be torn apart, and sacrifices must be made for the only family Kirk has left: his crew.|,/41mhrXASAW3sdn7LBWF49uCX0xi.jpg,2013-05-16,2.98614545811009,Action,Adventure,Science Fiction
A Beautiful Mind,|At Princeton University, John Nash struggles to make a worthwhile contribution to serve as his legacy to the world of mathematics. He finally makes a revolutionary breakthrough that will eventually earn him the Nobel Prize. After graduate school he turns to teaching, becoming romantically involved with his student Alicia. Meanwhile the government asks his help with breaking Soviet codes, which soon gets him involved in a terrifying conspiracy plot. Nash grows more and more paranoid until a discovery that turns his entire world upside down. Now it is only with Alicia's help that he will be able to recover his mental strength and regain his status as the great mathematician we know him as today.|,/4SFqHDZ1NvWdysucWbgnYlobdxC.jpg,2001-12-12,2.97640723639976,Drama,Romance
Exodus: Gods and Kings,|The defiant leader Moses rises up against the Egyptian Pharaoh Ramses, setting 600,000 slaves on a monumental journey of escape from Egypt and its terrifying cycle of deadly plagues.|,/f7SEuLjl2Ur2AX4YO5lxIP2IEVv.jpg,2014-12-12,3.32411829706157,Action,Adventure,Drama
Fight Club,|A ticking-time-bomb insomniac and a slippery soap salesman channel primal male aggression into a shocking new form of therapy. Their concept catches on, with underground "fight clubs" forming in every town, until an eccentric gets in the way and ignites an out-of-control spiral toward oblivion.|,/2lECpi35Hnbpa4y46JX0aY3AWTy.jpg,1999-10-14,2.73649670039897,Drama
The Godfather,|The story spans the years from 1945 to 1955 and chronicles the fictional Italian-American Corleone crime family. When organized crime family patriarch Vito Corleone barely survives an attempt on his life, his youngest son, Michael, steps in to take care of the would-be killers, launching a campaign of bloody revenge.|,/d4KNaTrltq6bpkFS01pYtyXa09m.jpg,1972-03-15,2.96967270884279,Crime,Drama
12 Years a Slave,|In the pre-Civil War United States, Solomon Northup, a free black man from upstate New York, is abducted and sold into slavery. Facing cruelty as well as unexpected kindnesses Solomon struggles not only to stay alive, but to retain his dignity. In the twelfth year of his unforgettable odyssey, Solomon’s chance meeting with a Canadian abolitionist will forever alter his life.|,/kb3X943WMIJYVg4SOAyK0pmWL5D.jpg,2013-10-30,2.9566395752149,Drama,History
Source Code,|Decorated soldier Captain Colter Stevens wakes up in the body of an unknown man, discovering he's involved in a mission to find the bomber of a Chicago commuter train. He learns he's part of a top-secret experimental program that enables him to experience the final 8 minutes of another person's life. Colter re-lives the train incident over and over again, gathering more clues each time. But can he discover who is responsible for the attack before the next one happens?|,/cpl7R5d3qwWvykRRSxdhQ0htstU.jpg,2011-04-01,2.94067686012458,Mystery,Science Fiction,Thriller
Alientampon,Some things are better left unused.,/ebFNuY3fpsspJV7ftStWyy0tI3M.jpg,2015-02-12,3.0,Action,Comedy,Horror,Science Fiction
The Fifth Element,|It’s the year 2257 and a taxi driver has been unintentionally given the task of saving a young girl who is part of the key that will ensure the survival of humanity. The Fifth Element takes place in a futuristic metropolitan city and is filmed in a French comic book aesthetic by a British, French and American lineup.|,/zaFa1NRZEnFgRTv5OVXkNIZO78O.jpg,1997-05-09,2.93176399608712,Action,Adventure,Fantasy,Science Fiction,Thriller
Ouija,A group of friends must confront their most terrifying fears when they awaken the dark powers of an ancient spirit board.,/i52JCZSHDvkHtjQwlPqMAsjULVH.jpg,2014-10-24,2.91720862915511,Horror
The November Man,An ex- CIA operative is brought back in on a very personal mission and finds himself pitted against his former pupil in a deadly game involving high level CIA officials and the Russian president-elect.,/lcg1bkriMVvc8m0jz5zk0yvzVTA.jpg,2014-08-27,3.2275773807818,Action,Crime,Thriller
Harry Potter and the Deathly Hallows: Part 1,|The end begins as Harry, Ron, and Hermione walk away from their last year at Hogwarts to find and destroy the remaining Horcruxes, putting an end to Voldemort's bid for immortality. But with Harry's beloved Dumbledore dead and Voldemort's unscrupulous Death Eaters on the loose, the world is more dangerous than ever.|,/maP4MTfPCeVD2FZbKTLUgriOW4R.jpg,2010-11-19,2.90110659929875,Adventure,Fantasy,Family
American Hustle,|A con man, Irving Rosenfeld, along with his seductive partner Sydney Prosser, is forced to work for a wild FBI agent, Richie DiMaso, who pushes them into a world of Jersey powerbrokers and mafia.|,/mhB7C62lSMpGO2HYNaW6d7W3TVH.jpg,2013-12-20,2.89938852331065,Crime,Drama
Argo,|As the Iranian revolution reaches a boiling point, a CIA 'exfiltration' specialist concocts a risky plan to free six Americans who have found shelter at the home of the Canadian ambassador.|,/oai3xLBQHpIh18VJdRCcL7D0Yg0.jpg,2012-10-12,2.89157543436985,Drama,Thriller
Quantum of Solace,|Quantum of Solace continues the adventures of James Bond after Casino Royale. Betrayed by Vesper, the woman he loved, 007 fights the urge to make his latest mission personal. Pursuing his determination to uncover the truth, Bond and M interrogate Mr. White, who reveals that the organization that blackmailed Vesper is far more complex and dangerous than anyone had imagined.|,/gXksXNwEk3h8tvSdhbsRp5GGJAk.jpg,2008-10-30,2.88834390375445,Action,Adventure,Crime,Thriller
The Lord of the Rings: The Return of the King,|Aragorn is revealed as the heir to the ancient kings as he, Gandalf and the other members of the broken fellowship struggle to save Gondor from Sauron's forces. Meanwhile, Frodo and Sam bring the ring closer to the heart of Mordor, the dark lord's realm.|,/50LoR9gJhbWZ5PpoHgi8MNTYgzd.jpg,2003-12-01,2.87565473980725,Action,Adventure,Fantasy
VANish,A kidnapped young woman is forced on a road trip full of murder and mayhem that takes place entirely in her captor's getaway van.,/9Ivu97Dej7zD2G4xnaK8zkDWwJC.jpg,2015-02-24,2.72065624403831,Action,Crime,Horror,Thriller
Divergent,|DIVERGENT is a thrilling action-adventure film set in a world where people are divided into distinct factions based on human virtues. Tris Prior is warned she is Divergent and will never fit into any one group. When she discovers a conspiracy by a faction leader to destroy all Divergents, Tris must learn to trust in the mysterious Four and together they must find out what makes being Divergent so dangerous before it's too late. Based on the best-selling book series by Veronica Roth.|,/yTtx2ciqk4XdN1oKhMMDy3f5ue3.jpg,2014-03-21,3.98912348243126,Action,Science Fiction
The Twilight Saga: Breaking Dawn - Part 1,|The new found married bliss of Bella Swan and vampire Edward Cullen is cut short when a series of betrayals and misfortunes threatens to destroy their world. Bella soon discovers she is pregnant, and during a nearly fatal childbirth, Edward finally fulfills her wish to become immortal. But the arrival of their remarkable daughter, Renesmee, sets in motion a perilous chain of events that pits the Cullens and their allies against the Volturi, the fearsome council of vampire leaders, setting the stage for an all-out battle.|,/eZQfeokiFBdvKHNrtQoM3tt2FWL.jpg,2011-11-17,2.83789152876357,Adventure,Fantasy,Romance
Prometheus,|A team of explorers discover a clue to the origins of mankind on Earth, leading them on a journey to the darkest corners of the universe. There, they must fight a terrifying battle to save the future of the human race.|,/idXq7NctkwoH59DRAIQlHEPtn95.jpg,2012-06-08,2.83315818878303,Adventure,Mystery,Science Fiction
The Lord of the Rings: The Two Towers,|Frodo and Sam are trekking to Mordor to destroy the One Ring of Power while Gimli, Legolas and Aragorn search for the orc-captured Merry and Pippin. All along, nefarious wizard Saruman awaits the Fellowship members at the Orthanc Tower in Isengard.|,/5o5fv1dHG7vWoH2hmqwihVPBoBm.jpg,2002-12-18,2.83237862938255,Action,Adventure,Fantasy
Taken 2,|In Istanbul, retired CIA operative Bryan Mills and his wife are taken hostage by the father of a kidnapper Mills killed while rescuing his daughter.|,/vknVdfSLjPwdfH1Bnzl7RU5tgKQ.jpg,2012-10-04,2.82506617880084,Action,Crime,Drama,Thriller
Alien,|During its return to the earth, commercial spaceship Nostromo intercepts a distress signal from a distant planet. When a three-member team of the crew discovers a chamber containing thousands of eggs on the planet, a creature inside one of the eggs attacks an explorer. The entire crew is unaware of the impending nightmare set to descend upon them when the alien parasite planted inside its unfortunate host is birthed.|,/uU9R1byS3USozpzWJ5oz7YAkXyk.jpg,1979-05-25,2.82356917518824,Action,Horror,Science Fiction,Thriller
The World Is Not Enough,|Greed, revenge, world dominance, high-tech terrorism -- it's all in a day's work for cunning MI6 agent James Bond, who's on a mission to protect beautiful oil heiress Elektra King from a notorious terrorist. In a race against time that culminates in a dramatic submarine showdown, Bond works to defuse the international power struggle that has the world's oil supply hanging in the balance.|,/tCarTEKvXjALk87r3wAxB4jb1ON.jpg,1999-11-21,2.8124418928993,Action,Adventure,Thriller
Star Trek,|The fate of the galaxy rests in the hands of bitter rivals. One, James Kirk, is a delinquent, thrill-seeking Iowa farm boy. The other, Spock, a Vulcan, was raised in a logic-based society that rejects all emotion. As fiery instinct clashes with calm reason, their unlikely but powerful partnership is the only thing capable of leading their crew through unimaginable danger, boldly going where no one has gone before. The human adventure has begun again.|,/fM0LKKgP0dtjNXQnAGA8WC1qr8h.jpg,2009-05-07,2.80986911229448,Action,Adventure,Science Fiction
Inception,|Cobb, a skilled thief who commits corporate espionage by infiltrating the subconscious of his targets is offered a chance to regain his old life as payment for a task considered to be impossible: "inception", the implantation of another person's idea into a target's subconscious.|,/qmDpIHrmpJINaRKAfWQfftjCdyi.jpg,2010-07-16,2.7239217096279,Action,Adventure,Mystery,Science Fiction,Thriller
LEGO DC Comics Super Heroes: Justice League vs. Bizarro League,|Superman’s clone, Bizarro, has become an embarrassing problem. Chaos and destruction follow Bizarro everywhere as he always hears the opposite of what is said, says the opposite of what he means and does the opposite of what is right. And when the citizens of Metropolis keep confusing Bizarro with Superman, the Man of Steel decides it’s time to find a new home for him…on another planet! It’s up to the Justice League to come to terms with their backward counterparts and team up with them to stop Darkseid and save the galaxy!|,/5JGoQPY6vdU2zP6pQPq2BoiF8ci.jpg,2015-02-10,2.80581287208013,Action,Adventure,Animation,Family
Ghost Rider,|In order to save his dying father, young stunt cyclist Johnny Blaze sells his soul to Mephistopheles and sadly parts from the pure-hearted Roxanne Simpson, the love of his life. Years later, Johnny's path crosses again with Roxanne, now a gogetting reporter, and also with Mephistopheles, who offers to release Johnny's soul if Johnny becomes the fabled, fiery Ghost Rider.|,/jnllnSq8u4d1oQPU7PsoAHD6bLU.jpg,2007-02-16,2.79784627969332,Action,Fantasy,Horror,Thriller
This Is the End,|While attending a party at James Franco's house, Seth Rogen, Jay Baruchel and many other celebrities are faced with the apocalypse.|,/1rMzHyOsk1b1ddcFJgMSB6kOASu.jpg,2013-06-12,3.50351454512944,Action,Comedy
Humpback Whales,An in-depth look at the lives of humpback whales and the challenges they face to avoid extinction.,/uT9hZdbSYylqs9iRjbAeOCPxNsH.jpg,2015-02-13,1.85985615375
