name,description,image,release_date,popularity,tags
It Follows,|For 19-year-old Jay, fall should be about school, boys and weekends out at the lake. But after a seemingly innocent physical encounter, she finds herself plagued by strange visions and the inescapable sense that someone, or something, is following her. Faced with this burden, Jay and her teenage friends must find a way to escape the horrors that seem to be only a few steps behind.|,/4MrwJZr0R9LbyOgZqwLNmtzzxbu.jpg,2015-03-13,5.878498,Thriller,Horror
Cinderella,|When her father unexpectedly passes away, young Ella finds herself at the mercy of her cruel stepmother and her daughters. Never one to give up hope, Ella's fortunes begin to change after meeting a dashing stranger in the woods.|,/2i0JH5WqYFqki7WDhUW56Sg0obh.jpg,2015-03-13,5.876853,Romance,Fantasy,Family,Drama
Terminator Salvation,|All grown up in post-apocalyptic 2018, John Connor must lead the resistance of humans against the increasingly dominating militaristic robots. But when Marcus Wright appears, his existence confuses the mission as Connor tries to determine whether Wright has come from the future or the past -- and whether he's friend or foe.|,/hxDfhavtxA2Ayx7O9BsQMcZRdG0.jpg,2009-05-20,5.836172,Drama,Action,Thriller,Science Fiction
Star Wars: Episode VI - Return of the Jedi,|As Rebel leaders map their strategy for an all-out attack on the Emperor's newer, bigger Death Star. Han Solo remains frozen in the cavernous desert fortress of Jabba the Hutt, the most loathsome outlaw in the universe, who is also keeping Princess Leia as a slave girl. Now a master of the Force, Luke Skywalker rescues his friends, but he cannot become a true Jedi Knight until he wages his own crucial battle against Darth Vader, who has sworn to win Luke over to the dark side of the Force.|,/jx5p0aHlbPXqe3AH9G15NvmWaqQ.jpg,1983-05-25,5.836133,Adventure,Action,Science Fiction
Pitch Perfect 2,|The Bellas are back, and they are better than ever. After being humiliated in front of none other than the President of the United States of America, the Bellas are taken out of the Aca-Circuit. In order to clear their name, and regain their status, the Bellas take on a seemingly impossible task: winning an international competition no American team has ever won. In order to accomplish this monumental task, they need to strengthen the bonds of friendship and sisterhood and blow away the competition with their amazing aca-magic! With all new friends and old rivals tagging along for the trip, the Bellas can hopefully accomplish their dreams.|,/qSjruLiFB4uqRtz2xheQPxG8uaB.jpg,2015-05-15,5.774893,Comedy,Music
Captain America: Civil War,|Following the events of Age of Ultron, the collective governments of the world pass an act designed to regulate all superhuman activity. This polarizes opinion amongst the Avengers, causing two factions to side with Iron Man or Captain America, which causes an epic battle between former allies|,/6vzNCyVNPkcITEMKl3oXnWm8QMs.jpg,2016-05-06,5.751122,Action,Science Fiction,Thriller
Vacation,|Hoping to bring his family closer together and to recreate his childhood vacation for his own kids, a grown up Rusty Griswold takes his wife and their two sons on a cross-country road trip to the coolest theme park in America, Walley World. Needless to say, things don't go quite as planned.|,/q9kL9WW0Uu4AcfTi5iCLcYzBgnm.jpg,2015-07-29,5.741739,Adventure,Comedy
Captain America: The First Avenger,|Predominantly set during World War II, Steve Rogers is a sickly man from Brooklyn who's transformed into super-soldier Captain America to aid in the war effort. Rogers must stop the Red Skull – Adolf Hitler's ruthless head of weaponry, and the leader of an organization that intends to use a mysterious device of untold powers for world domination.|,/dlIPGXPxXQTp9kFrRzn0RsfUelx.jpg,2011-07-22,5.650983,Science Fiction,Action,Adventure
The Equalizer,|In The Equalizer, Denzel Washington plays McCall, a man who believes he has put his mysterious past behind him and dedicated himself to beginning a new, quiet life. But when McCall meets Teri (Chloë Grace Moretz), a young girl under the control of ultra-violent Russian gangsters, he can’t stand idly by – he has to help her. Armed with hidden skills that allow him to serve vengeance against anyone who would brutalize the helpless, McCall comes out of his self-imposed retirement and finds his desire for justice reawakened. If someone has a problem, if the odds are stacked against them, if they have nowhere else to turn, McCall will help. He is The Equalizer.|,/2eQfjqlvPAxd9aLDs8DvsKLnfed.jpg,2014-09-26,5.60748,Thriller,Action,Crime
How to Train Your Dragon 2,|The thrilling second chapter of the epic How To Train Your Dragon trilogy brings back the fantastical world of Hiccup and Toothless five years later. While Astrid, Snotlout and the rest of the gang are challenging each other to dragon races (the island's new favorite contact sport), the now inseparable pair journey through the skies, charting unmapped territories and exploring new worlds. When one of their adventures leads to the discovery of a secret ice cave that is home to hundreds of new wild dragons and the mysterious Dragon Rider, the two friends find themselves at the center of a battle to protect the peace.|,/lRjOR4uclMQijUav4OjeZprlehu.jpg,2014-06-13,5.567638,Fantasy,Action,Adventure,Animation,Comedy,Family
Star Wars: Episode I - The Phantom Menace,|Anakin Skywalker, a young slave strong with the Force, is discovered on Tatooine. Meanwhile, the evil Sith have returned, enacting their plot for revenge against the Jedi.|,/n8V09dDc02KsSN6Q4hC2BX6hN8X.jpg,1999-05-19,5.549506,Adventure,Action,Science Fiction
Teenage Mutant Ninja Turtles,The city needs heroes. Darkness has settled over New York City as Shredder and his evil Foot Clan have an iron grip on everything from the police to the politicians. The future is grim until four unlikely outcast brothers rise from the sewers and discover their destiny as Teenage Mutant Ninja Turtles. The Turtles must work with fearless reporter April and her wise-cracking cameraman Vern Fenwick to save the city and unravel Shredder's diabolical plan.,/oDL2ryJ0sV2bmjgshVgJb3qzvwp.jpg,2014-08-08,5.477775,Science Fiction,Action,Adventure,Fantasy,Comedy
Hitman: Agent 47,An assassin teams up with a woman to help her find her father and uncover the mysteries of her ancestry.,/4VmZeT8YkuMI6BrA623mHZDISlN.jpg,2015-08-21,5.459663,Action,Crime,Thriller
Frozen,|Young princess Anna of Arendelle dreams about finding true love at her sister Elsa’s coronation. Fate takes her on a dangerous journey in an attempt to end the eternal winter that has fallen over the kingdom. She's accompanied by ice delivery man Kristoff, his reindeer Sven, and snowman Olaf. On an adventure where she will find out what friendship, courage, family, and true love really means.|,/jIjdFXKUNtdf1bwqMrhearpyjMj.jpg,2013-11-27,5.369799,Animation,Adventure,Family
Avatar,|In the 22nd century, a paraplegic Marine is dispatched to the moon Pandora on a unique mission, but becomes torn between following orders and protecting an alien civilization.|,/tcqb9NHdw9SWs2a88KCDD4V8sVR.jpg,2009-12-18,5.335574,Action,Adventure,Fantasy,Science Fiction
American Sniper,|U.S. Navy SEAL Chris Kyle (Bradley Cooper) takes his sole mission—protect his comrades—to heart and becomes one of the most lethal snipers in American history. His pinpoint accuracy not only saves countless lives but also makes him a prime target of insurgents. Despite grave danger and his struggle to be a good husband and father to his family back in the States, Kyle serves four tours of duty in Iraq. However, when he finally returns home, he finds that he cannot leave the war behind.|,/svPHnYE7N5NAGO49dBmRhq0vDQ3.jpg,2014-12-25,5.291166,War,Action
Casino Royale,|James Bond goes on his first ever mission as a 00. Le Chiffre is a banker to the world's terrorists. He is participating in a poker game at Montenegro, where he must win back his money, in order to stay safe among the terrorist market. The boss of MI6, known simply as M sends Bond, along with Vesper Lynd to attend this game and prevent Le Chiffre from winning. Bond, using help from Felix Leiter, Mathis and having Vesper pose as his wife, enters the most important poker game in his already dangerous career. But if Bond defeats Le Chiffre, will he and Vesper Lynd remain safe?|,/zlWBxz2pTA9p45kUTrI8AQiKrHm.jpg,2006-11-15,5.255422,Adventure,Action,Thriller
Gladiator,|Gladiator is an epic film of love, death and betrayal set in the Roman Empire. General Maximus' success in battle earns the favour of an elderly Emperor at the expense of the Emperor's son. In a fit of jealous rage the son slays his father before turning his anger towards Maximus. Now reduced to a slave, his family dead, Maximus must fight as a gladiator to gain his freedom, and his revenge.|,/6WBIzCgmDCYrqh64yDREGeDk9d3.jpg,2000-05-01,5.243961,Action,Drama,Adventure
The Age of Adaline,|After 29-year-old Adaline recovers from a nearly lethal accident, she inexplicably stops growing older. As the years stretch on and on, Adaline keeps her secret to herself  until she meets a man who changes her life.|,/gEDGROZ4NQDlRjUPPSSyIf0hKvD.jpg,2015-04-24,5.202836,Fantasy,Drama,Romance
Night at the Museum: Secret of the Tomb,|When the magic powers of The Tablet of Ahkmenrah begin to die out, Larry Daley (Ben Stiller) spans the globe, uniting favorite and new characters while embarking on an epic quest to save the magic before it is gone forever.|,/tWwASv4CU1Au1IukacdSUewDCV3.jpg,2014-12-19,5.196144,Adventure,Comedy,Fantasy,Family
Thor,|Against his father Odin's will, The Mighty Thor -a powerful but arrogant warrior god -recklessly reignites an ancient war. Thor is cast down to Earth and forced to live among humans as punishment. Once here, Thor learns what it takes to be a true hero when the most dangerous villain of his world sends the darkest forces of Asgard to invade Earth.|,/bIuOWTtyFPjsFDevqvF3QrD1aun.jpg,2011-05-06,5.102904,Adventure,Fantasy,Action
Le Petit Prince,|Based on the best-seller book 'The Little Prince', the movie tells the story of a little girl that lives with resignation in a world where efficiency and work are the only dogmas. Everything will change when accidentally she discovers her neighbor that will tell her about the story of the Little Prince that he once met.|,/eDPVn6f1KlI2XgASAmqSjlHPdjK.jpg,2015-08-20,5.092627,Adventure,Fantasy,Animation
The Lord of the Rings: The Return of the King,|Aragorn is revealed as the heir to the ancient kings as he, Gandalf and the other members of the broken fellowship struggle to save Gondor from Sauron's forces. Meanwhile, Frodo and Sam bring the ring closer to the heart of Mordor, the dark lord's realm.|,/50LoR9gJhbWZ5PpoHgi8MNTYgzd.jpg,2003-12-01,4.972548,Adventure,Fantasy,Action
Django Unchained,|With the help of a German bounty hunter, a freed slave sets out to rescue his wife from a brutal Mississippi plantation owner.|,/5WJnxuw41sddupf8cwOxYftuvJG.jpg,2012-12-25,4.945816,Drama,Western
The Lord of the Rings: The Fellowship of the Ring,|Young hobbit Frodo Baggins, after inheriting a mysterious ring from his uncle Bilbo, must leave his home in order to keep it from falling into the hands of its evil creator. Along the way, a fellowship is formed to protect the ringbearer and make sure that the ring arrives at its final destination: Mt. Doom, the only place where it can be destroyed.|,/bxVxZb5O9OxCO0oRUNdCnpy9NST.jpg,2001-12-19,4.875617,Adventure,Fantasy,Action
The Dark Knight Rises,|Following the death of District Attorney Harvey Dent, Batman assumes responsibility for Dent's crimes to protect the late attorney's reputation and is subsequently hunted by the Gotham City Police Department. Eight years later, Batman encounters the mysterious Selina Kyle and the villainous Bane, a new terrorist leader who overwhelms Gotham's finest. The Dark Knight resurfaces to protect a city that has branded him an enemy.|,/dEYnvnUfXrqvqeRSqvIEtmzhoA8.jpg,2012-07-20,4.862696,Action,Crime,Drama,Thriller
No Escape,|In their new overseas home, an American family soon finds themselves caught in the middle of a coup, and they frantically look for a safe escape in an environment where foreigners are being immediately executed.|,/2tFNO3dfePfNXslg3ZNAeyFwkx2.jpg,2015-08-26,4.843851,Action,Thriller
Hercules,|Fourteen hundred years ago, a tormented soul walked the earth that was neither man nor god. Hercules was the powerful son of the god king Zeus, for this he received nothing but suffering his entire life. After twelve arduous labors and the loss of his family, this dark, world-weary soul turned his back on the gods finding his only solace in bloody battle. Over the years he warmed to the company of six similar souls, their only bond being their love of fighting and presence of death. These men and woman never question where they go to fight or why or whom, just how much they will be paid. Now the King of Thrace has hired these mercenaries to train his men to become the greatest army of all time. It is time for this bunch of lost souls to finally have their eyes opened to how far they have fallen when they must train an army to become as ruthless and blood thirsty as their reputation has become.|,/wGAWxOnVjwXqvoiKX7Pf6XOWnPJ.jpg,2014-07-23,4.731834,Action,Adventure
Terminator 3: Rise of the Machines,|It's been 10 years since John Connor saved Earth from Judgment Day, and he's now living under the radar, steering clear of using anything Skynet can trace. That is, until he encounters T-X, a robotic assassin ordered to finish what T-1000 started. Good thing Connor's former nemesis, the Terminator, is back to aid the now-adult Connor … just like he promised.|,/lz4xYdF1n09lyiCfZWtWT44SZiG.jpg,2003-06-30,4.719955,Action,Thriller,Science Fiction
Lucy,|A woman, accidentally caught in a dark deal, turns the tables on her captors and transforms into a merciless warrior evolved beyond human logic.|,/rwn876MeqienhOVSSjtUPnwxn0Z.jpg,2014-07-25,4.697748,Action,Science Fiction
Mortdecai,|Art dealer, Charles Mortdecai, searches for a stolen painting rumored to contain a secret code that gains access to hidden Nazi gold.|,/chgpheyKaJzOVN6u3n2tJupO4aC.jpg,2015-01-23,4.682049,Comedy,Adventure
Star Wars: Episode III - Revenge of the Sith,|Years after the onset of the Clone Wars, the noble Jedi Knights lead a massive clone army into a galaxy-wide battle against the Separatists. When the sinister Sith unveil a thousand-year-old plot to rule the galaxy, the Republic crumbles and from its ashes rises the evil Galactic Empire. Jedi hero Anakin Skywalker is seduced by the dark side of the Force to become the Emperor's new apprentice -- Darth Vader. The Jedi are decimated, as Obi-Wan Kenobi and Jedi Master Yoda are forced into hiding. The only hope for the galaxy are Anakin's own offspring -- the twin children born in secrecy who will grow up to become heroes.|,/tgr5Pdy7ehZYBqBkN2K7Q02xgOb.jpg,2005-05-19,4.676667,Science Fiction,Adventure,Action
Spy,|A desk-bound CIA analyst volunteers to go undercover to infiltrate the world of a deadly arms dealer, and prevent diabolical global disaster.|,/gCBw0AQDhlo0bNetkjsSRWzrxpW.jpg,2015-06-05,4.666325,Crime,Action,Comedy
Alice in Wonderland,|Alice, an unpretentious and individual 19-year-old, is betrothed to a dunce of an English nobleman. At her engagement party, she escapes the crowd to consider whether to go through with the marriage and falls down a hole in the garden after spotting an unusual rabbit. Arriving in a strange and surreal place called 'Underland,' she finds herself in a world that resembles the nightmares she had as a child, filled with talking animals, villainous queens and knights, and frumious bandersnatches. Alice realizes that she is there for a reason--to conquer the horrific Jabberwocky and restore the rightful queen to her throne.|,/pvEE5EN5N1yjmHmldfL4aJWm56l.jpg,2010-03-04,4.634809,Family,Fantasy,Adventure
Aladdin,|Princess Jasmine grows tired of being forced to remain in the palace and she sneaks out into the marketplace  in disguise where she meets street-urchin Aladdin and the two fall in love, although she may only marry a prince. After being thrown in jail, Aladdin and becomes embroiled in a plot to find a mysterious lamp with which the evil Jafar hopes to rule the land.|,/qsHpmqekgeQKMKL8PWnFsrXTXGs.jpg,1992-11-25,4.540258,Animation,Family,Comedy,Adventure,Fantasy,Romance
同班同學,|Childhood friends Tracy, Chloe and Alice share an apartment over the summer. They live close together, meet guys and sell their company as well as sex.  With a romantic imagery and sometimes provocative theme the female debutant director Luk Yee-sum give the audience a playful story about sexuality, desire and friendship.|,/26DGx7WWfiDL1uSGUYx9CQtNnBU.jpg,2015-10-29,4.535145,Romance
The Lion King,A young lion cub named Simba can't wait to be king. But his uncle craves the title for himself and will stop at nothing to get it.,/bKPtXn9n4M4s8vvZrbw40mYsefB.jpg,1994-06-23,4.513834,Animation,Family
Goosebumps,|A young kid teams up with the niece of young adult horror author R.L. Stine after the writer's imaginary demons are set free on the town of Greendale, Maryland.|,/lNPMamUICDTZT6Njg57A6z9BEo3.jpg,2015-10-16,4.510218,Adventure,Horror,Comedy
Terminator 2: Judgment Day,|Nearly 10 years have passed since Sarah Connor was targeted for termination by a cyborg from the future. Now her son, John, the future leader of the resistance, is the target for a newer, more deadly terminator. Once again, the resistance has managed to send a protector back to attempt to save John and his mother Sarah.|,/2y4dmgWYRMYXdD1UyJVcn2HSd1D.jpg,1991-07-01,4.474366,Action,Thriller,Science Fiction
Victoria,A young Spanish woman who has newly moved to Berlin finds her flirtation with a local guy turn potentially deadly as their night out with his friends reveals a dangerous secret.,/t66eAg7xBLGoSSoA8JtJtX3NKs1.jpg,2015-06-11,4.470722,Crime,Drama,Thriller
Blackhat,A man is released from prison to help American and Chinese authorities pursue a mysterious cyber criminal. The dangerous search leads them from Chicago to Hong Kong.,/sW3VEsulmxMlOmQwm0h7H7lZROi.jpg,2015-01-16,4.453369,Mystery,Crime,Action,Thriller,Drama
Inception,|Cobb, a skilled thief who commits corporate espionage by infiltrating the subconscious of his targets is offered a chance to regain his old life as payment for a task considered to be impossible: "inception", the implantation of another person's idea into a target's subconscious.|,/qmDpIHrmpJINaRKAfWQfftjCdyi.jpg,2010-07-16,4.412419,Action,Thriller,Science Fiction,Mystery,Adventure
Shrek,|It ain't easy bein' green -- especially if you're a likable (albeit smelly) ogre named Shrek. On a mission to retrieve a gorgeous princess from the clutches of a fire-breathing dragon, Shrek teams up with an unlikely compatriot -- a wisecracking donkey.|,/140ewbWv8qHStD3mlBDvvGd0Zvu.jpg,2001-05-16,4.40557,Family,Fantasy,Adventure,Animation,Comedy
Iron Man 3,|The brash-but-brilliant industrialist Tony Stark faces an enemy whose reach knows no bounds. When Stark finds his personal world destroyed at his enemy’s hands, he embarks on a harrowing quest to find those responsible. This journey, at every turn, will test his mettle. With his back against the wall, Stark is left to survive by his own devices, relying on his ingenuity and instincts to protect those closest to him. As he fights his way back, Stark discovers the answer to the question that has secretly haunted him: does the man make the suit or does the suit make the man?|,/1Ilv6ryHUv6rt9zIsbSEJUmmbEi.jpg,2013-05-03,4.39095,Action,Adventure,Science Fiction
Fight Club,|A ticking-time-bomb insomniac and a slippery soap salesman channel primal male aggression into a shocking new form of therapy. Their concept catches on, with underground "fight clubs" forming in every town, until an eccentric gets in the way and ignites an out-of-control spiral toward oblivion.|,/811DjJTon9gD6hZ8nCjSitaIXFQ.jpg,1999-10-14,4.356493,Drama
Toy Story,Woody the cowboy is young Andy’s favorite toy. Yet this changes when Andy get the new super toy Buzz Lightyear for his birthday. Now that Woody is no longer number one he plans his revenge on Buzz. Toy Story is a milestone in film history for being the first feature film to use entirely computer animation.,/agy8DheVu5zpQFbXfAdvYivF2FU.jpg,1995-11-21,4.354507,Animation,Comedy,Family
Penguins of Madagascar,|Skipper, Kowalski, Rico and Private join forces with undercover organization The North Wind to stop the villainous Dr. Octavius Brine from destroying the world as we know it.|,/pRer59eyY4rjkLPeKXKo7fPxCHH.jpg,2014-11-26,4.35173,Family,Animation,Adventure,Comedy
Mission: Impossible – Ghost Protocol,|In the 4th installment of the Mission Impossible series, Ethan Hunt (Cruise) and his team are racing against time to track down a dangerous terrorist named Hendricks (Nyqvist), who has gained access to Russian nuclear launch codes and is planning a strike on the United States. An attempt to stop him ends in an explosion causing severe destruction to the Kremlin and the IMF to be implicated in the bombing, forcing the President to disavow them. No longer being aided by the government, Ethan and his team chase Hendricks around the globe, although they might still be too late to stop a disaster.|,/s58mMsgIVOFfoXPtwPWJ3hDYpXf.jpg,2011-12-21,4.348422,Action,Thriller,Adventure
Sex Tape,|When Jay and Annie first got together, their romantic connection was intense – but ten years and two kids later, the flame of their love needs a spark.  To kick things up a notch, they decide – why not? – to make a video of themselves trying out every position in The Joy of Sex in one marathon three-hour session.  It seems like a great idea – until they discover that their most private video is no longer private.  With their reputations on the line, they know they’re just one click away from being laid bare to the world... but as their race to reclaim their video leads to a night they'll never forget, they'll find that their video will expose even more than they bargained for.|,/2BMmIPGu5ZbTrwXwomdSUuTB2Ul.jpg,2014-07-18,4.342458,Comedy
The Interview,|Dave Skylark is king of the celebrity interview and host of the hit night time talk show "Skylark Tonight."  The brain behind Dave's empire is his producer and best friend, Aaron Rapoport. Unfulfilled, Aaron yearns to do meaningful work.  He scores the chance of a lifetime when he secures an interview for Dave with Kim Jong-Un, the mysterious and ruthless dictator of a nuclear-armed North Korea.  As Dave and Aaron prepare to leave for North Korea, they are approached by the CIA and asked to assassinate Kim.  They accept the mission, becoming two of the least qualified men ever to assassinate – or interview – the most dangerous man on earth.|,/2uWb0aSm5cFmRCHP95OdA6hvTEs.jpg,2014-12-25,4.339464,Action,Comedy
The Terminator,|In the post-apocalyptic future, reigning tyrannical supercomputers teleport a cyborg assassin known as the "Terminator" back to 1984 to kill Sarah Connor, whose unborn son is destined to lead insurgents against 21st century mechanical hegemony. Meanwhile, the human-resistance movement dispatches a lone warrior to safeguard Sarah. Can he stop the virtually indestructible killing machine?|,/q8ffBuxQlYOHrvPniLgCbmKK4Lv.jpg,1984-10-26,4.331216,Action,Thriller,Science Fiction
Exodus: Gods and Kings,|The defiant leader Moses rises up against the Egyptian Pharaoh Ramses, setting 600,000 slaves on a monumental journey of escape from Egypt and its terrifying cycle of deadly plagues.|,/tCN8NXset4NQ5qU0uBxqKOM0r5r.jpg,2014-12-12,4.330044,Adventure,Drama,Action
Iron Man,|Tony Stark. Genius, billionaire, playboy, philanthropist. Son of legendary inventor and weapons contractor Howard Stark. When Tony Stark is assigned to give a weapons presentation to an Iraqi unit led by Lt. Col. James Rhodes, he's given a ride on enemy lines. That ride ends badly when Stark's Humvee that he's riding in is attacked by enemy combatants. He survives - barely - with a chest full of shrapnel and a car battery attached to his heart. In order to survive he comes up with a way to miniaturize the battery and figures out that the battery can power something else. Thus Iron Man is born. He uses the primitive device to escape from the cave in Iraq. Once back home, he then begins work on perfecting the Iron Man suit. But the man who was put in charge of Stark Industries has plans of his own to take over Tony's technology for other matters.|,/848chlIWVT41VtAAgyh9bWymAYb.jpg,2008-05-02,4.322848,Action,Science Fiction,Adventure
The Godfather,|The story spans the years from 1945 to 1955 and chronicles the fictional Italian-American Corleone crime family. When organized crime family patriarch Vito Corleone barely survives an attempt on his life, his youngest son, Michael, steps in to take care of the would-be killers, launching a campaign of bloody revenge.|,/d4KNaTrltq6bpkFS01pYtyXa09m.jpg,1972-03-15,4.292856,Drama,Crime
Cars,|Lightning McQueen, a hotshot rookie race car driven to succeed, discovers that life is about the journey, not the finish line, when he finds himself unexpectedly detoured in the sleepy Route 66 town of Radiator Springs. On route across the country to the big Piston Cup Championship in California to compete against two seasoned pros, McQueen gets to know the town's offbeat characters.|,/5damnMcRFKSjhCirgX3CMa88MBj.jpg,2006-06-09,4.269309,Animation,Adventure,Comedy,Family
