name,description,image,release_date,popularity,tags
Transformers: Age of Extinction,|As humanity picks up the pieces, following the conclusion of "Transformers: Dark of the Moon," Autobots and Decepticons have all but vanished from the face of the planet. However, a group of powerful, ingenious businessman and scientists attempt to learn from past Transformer incursions and push the boundaries of technology beyond what they can control - all while an ancient, powerful Transformer menace sets Earth in his cross-hairs.|,/ykIZB9dYBIKV13k5igGFncT5th6.jpg,2014-06-27,5.15137781404328,Action,Adventure,Science Fiction
Gravity,|Dr. Ryan Stone (Sandra Bullock), a brilliant medical engineer on her first Shuttle mission, with veteran astronaut Matt Kowalsky (George Clooney) in command of his last flight before retiring. But on a seemingly routine spacewalk, disaster strikes. The Shuttle is destroyed, leaving Stone and Kowalsky completely alone-tethered to nothing but each other and spiraling out into the blackness of space. The deafening silence tells them they have lost any link to Earth and any chance for rescue. As fear turns to panic, every gulp of air eats away at what little oxygen is left. But the only way home may be to go further out into the terrifying expance of space…|,/2gPjLWIyrWlAn2DgKMOKTBnZYyO.jpg,2013-10-04,3.81839798668003,Drama,Science Fiction,Thriller
World War Z,|Life for former United Nations investigator Gerry Lane and his family seems content. Suddenly, the world is plagued by a mysterious infection turning whole human populations into rampaging mindless zombies. After barely escaping the chaos, Lane is persuaded to go on a mission to investigate this disease. What follows is a perilous trek around the world where Lane must brave horrific dangers and long odds to find answers before human civilization falls.|,/gAt1PrsrFY1nX6UzebeiHP8njE9.jpg,2013-06-21,4.61923527581039,Action,Drama,Horror,Science Fiction,Thriller
Thor: The Dark World,|Thor fights to restore order across the cosmos… but an ancient race led by the vengeful Malekith returns to plunge the universe back into darkness. Faced with an enemy that even Odin and Asgard cannot withstand, Thor must embark on his most perilous and personal journey yet, one that will reunite him with Jane Foster and force him to sacrifice everything to save us all.|,/aROh4ZwLfv9tmtOAsrnkYTbpujA.jpg,2013-11-08,5.15380619474133,Action,Adventure,Fantasy
Seventh Son,|John Gregory, who is a seventh son of a seventh son and also the local spook, has protected he country from witches, boggarts, ghouls and all manner of things that go bump in the night. However John is not young anymore, and has been seeking an apprentice to carry on his trade. Most have failed to survive. The last hope is a young farmer's son named Thomas Ward. Will he survive the training to become the spook that so many others couldn't?|,/saJi9Vs37zLmUENyIEdhgURk3a1.jpg,2015-02-06,4.54413380251905,Adventure,Fantasy,Family
Laggies,|Overeducated and underemployed, 28 year old Megan is in the throes of a quarterlife crisis. Squarely into adulthood with no career prospects, no particular motivation to think about her future and no one to relate to, Megan is comfortable lagging a few steps behind - while her friends check off milestones and celebrate their new grown-up status. When her high-school sweetheart proposes, Megan panics and- given an unexpected opportunity to escape for a week - hides out in the home of her new friend, 16-year old Annika and Annika's world-weary single dad Craig.|,/dNcoXoRC7JHiqbe7k5Ufo6syiPP.jpg,2014-10-24,4.50441634217174,Comedy,Romance
Inherent Vice,|In Los Angeles at the turn of the 1970s, drug-fueled detective Larry "Doc" Sportello investigates the disappearance of an ex-girlfriend.|,/2fCg6FORkgRLpFIKlUg4gULIn1u.jpg,2014-12-12,4.41213653202417,Comedy,Crime,Drama,Mystery,Romance
The Wolf of Wall Street,|A New York stockbroker refuses to cooperate in a large securities fraud case involving corruption on Wall Street, corporate banking world and mob infiltration. Based on Jordan Belfort's autobiography.|,/wAgdJRx4uZ0u4uzu34NOMvtjLAR.jpg,2013-12-25,4.40901348643286,Comedy,Crime,Drama
22 Jump Street,|After making their way through high school (twice), big changes are in store for officers Schmidt and Jenko when they go deep undercover at a local college. But when Jenko meets a kindred spirit on the football team, and Schmidt infiltrates the bohemian art major scene, they begin to question their partnership. Now they don't have to just crack the case - they have to figure out if they can have a mature relationship. If these two overgrown adolescents can grow from freshmen into real men, college might be the best thing that ever happened to them.|,/gNlV5FhDZ1PjxSv2aqTPS30GEon.jpg,2014-06-13,4.31554134968496,Action,Comedy,Crime
Edge of Tomorrow,|Major Bill Cage is an officer who has never seen a day of combat when he is unceremoniously demoted and dropped into combat. Cage is killed within minutes, managing to take an alpha alien down with him. He awakens back at the beginning of the same day and is forced to fight and die again... and again - as physical contact with the alien has thrown him into a time loop.|,/tpoVEYvm6qcXueZrQYJNRLXL88s.jpg,2014-06-06,4.26556631035794,Action,Science Fiction
Outcast,|A mysterious warrior teams up with the daughter and son of a deposed Chinese Emperor to defeat their cruel Uncle, who seeks their deaths.|,/dUIubxF5osHOJxS3mJNWCqTqWn5.jpg,2015-02-27,4.19898112037137,Action
The Avengers,|When an unexpected enemy emerges and threatens global safety and security, Nick Fury, director of the international peacekeeping agency known as S.H.I.E.L.D., finds himself in need of a team to pull the world back from the brink of disaster. Spanning the globe, a daring recruitment effort begins!|,/cezWGskPY5x7GaglTTRN4Fugfb8.jpg,2012-05-04,4.18619205467349,Action,Adventure,Science Fiction
Sin City: A Dame to Kill For,Some of Sin City's most hard-boiled citizens cross paths with a few of its more reviled inhabitants.,/k80qKrJ0qQ6ocVo5N932stNSg6j.jpg,2014-08-22,5.08369776061736,Crime
Girlhouse,|A HALLOWEEN-style slasher for the digital age, it follows a beautiful young college student who, needing money for tuition, moves into a house that streams content to an X-rated website.|,/w6lvw6zMnvVB1dAHGkUQ7tCLFpO.jpg,2015-02-13,4.16007212345676,Horror,Thriller
The Boy Next Door,|A newly divorced woman falls for a younger man who has recently moved in across the street from her, but their torrid affair soon takes a dangerous turn.|,/9scuwyaJBqxMmapuyts4s2zt9sP.jpg,2015-01-23,4.14994929790795,Thriller
Iron Man 2,|Now that his Super Hero secret has been revealed, Tony Stark's life is more intense than ever. Everyone wants in on the Iron Man technology, whether for power or profit... But for Ivan Vanko, it's revenge! Tony must once again suit up and face his most dangerous enemy yet, but not without a few new allies of his own.|,/1LoT5WsN4Lc1aR7A18ciSA1LoMy.jpg,2010-05-07,4.1484461634258,Action,Adventure,Science Fiction
Sex Tape,|When Jay and Annie first got together, their romantic connection was intense – but ten years and two kids later, the flame of their love needs a spark.  To kick things up a notch, they decide – why not? – to make a video of themselves trying out every position in The Joy of Sex in one marathon three-hour session.  It seems like a great idea – until they discover that their most private video is no longer private.  With their reputations on the line, they know they’re just one click away from being laid bare to the world... but as their race to reclaim their video leads to a night they'll never forget, they'll find that their video will expose even more than they bargained for.|,/bYY46f0PSLJTXzitxGOCd00rj3Y.jpg,2014-07-18,4.60393332332098,Comedy
The Grand Budapest Hotel,|The Grand Budapest Hotel tells of a legendary concierge at a famous European hotel between the wars and his friendship with a young employee who becomes his trusted protégé. The story involves the theft and recovery of a priceless Renaissance painting, the battle for an enormous family fortune and the slow and then sudden upheavals that transformed Europe during the first half of the 20th century.|,/nX5XotM9yprCKarRH4fzOq1VM1J.jpg,2014-03-07,4.08458922772325,Comedy,Drama
How to Train Your Dragon,|As the son of a Viking leader on the cusp of manhood, shy Hiccup Horrendous Haddock III faces a rite of passage: he must kill a dragon to prove his warrior mettle. But after downing a feared dragon, he realizes that he no longer wants to destroy it, and instead befriends the beast – which he names Toothless – much to the chagrin of his warrior father|,/zMAm3WYmvD40FaWFsOmpicQFabz.jpg,2010-03-05,4.0678178597089,Adventure,Animation,Fantasy,Family
American Heist,|Two brothers, both with troubled paths, find themselves in the middle of one last bank job.|,/6BPoMjHNqLxMhIeoGO1zpcpQWlw.jpg,2014-09-11,4.00752238514197,Action
Maleficent,|The untold story of Disney's most iconic villain from the 1959 classic 'Sleeping Beauty'. A beautiful, pure-hearted young woman, Maleficent has an idyllic life growing up in a peaceable forest kingdom, until one day when an invading army threatens the harmony of the land.  Maleficent rises to be the land's fiercest protector, but she ultimately suffers a ruthless betrayal – an act that begins to turn her heart into stone. Bent on revenge, Maleficent faces an epic battle with the invading King's successor and, as a result, places a curse upon his newborn infant Aurora. As the child grows, Maleficent realizes that Aurora holds the key to peace in the kingdom - and to Maleficent's true happiness as well.|,/4FYu1AAu14tuBU0lns0hbKiHUcH.jpg,2014-05-30,3.98828005715807,Action,Adventure,Fantasy,Romance,Family
Captain America: The First Avenger,|Predominantly set during World War II, Steve Rogers is a sickly man from Brooklyn who's transformed into super-soldier Captain America to aid in the war effort. Rogers must stop the Red Skull – Adolf Hitler's ruthless head of weaponry, and the leader of an organization that intends to use a mysterious device of untold powers for world domination.|,/sBZs1jSybBRBXDwcCR8IOyHLUMc.jpg,2011-07-22,3.9691708015218,Action,Adventure,Science Fiction
Avengers: Age of Ultron,|When Tony Stark tries to jumpstart a dormant peacekeeping program, things go awry and Earth’s Mightiest Heroes are put to the ultimate test as the fate of the planet hangs in the balance. As the villainous Ultron emerges, it is up to The Avengers to stop him from enacting his terrible plans, and soon uneasy alliances and unexpected action pave the way for an epic and unique global adventure.|,/nveEFHidaEXZCG7zhfTc26hVqSu.jpg,2015-05-01,3.96683688203624,Action,Adventure,Science Fiction
Captain Phillips,|The true story of Captain Richard Phillips and the 2009 hijacking by Somali pirates of the US-flagged MV Maersk Alabama, the first American cargo ship to be hijacked in two hundred years.|,/AnMTMPTUzeWNbYxzp29WqYf1br1.jpg,2013-10-11,3.93295566092215,Action,Drama,Thriller
Accidental Love,|A small town waitress gets a nail accidentally lodged in her head causing unpredictable behavior that leads her to Washington, DC, where sparks fly when she meets a clueless young senator who takes up her cause - but what happens when love interferes with what you stand for?|,/qJyEr1YzO0ejI6fW2rulfhEzcr.jpg,2015-02-10,3.93437441943197,Comedy,Romance
Predestination,|Predestination chronicles the life of a Temporal Agent (Ethan Hawke) sent on an intricate series of time-travel journeys designed to prevent future killers from committing their crimes. Now, on his final assignment, the Agent must stop the one criminal that has eluded him throughout time and prevent a devastating attack in which thousands of lives will be lost.|,/kDdUtDsGMQ3OYwoBtEQyJIGPz4V.jpg,2014-08-28,5.58668421232476,Science Fiction,Thriller
Gladiator,|Gladiator is an epic film of love, death and betrayal set in the Roman Empire. General Maximus' success in battle earns the favour of an elderly Emperor at the expense of the Emperor's son. In a fit of jealous rage the son slays his father before turning his anger towards Maximus. Now reduced to a slave, his family dead, Maximus must fight as a gladiator to gain his freedom, and his revenge.|,/6WBIzCgmDCYrqh64yDREGeDk9d3.jpg,2000-05-01,3.8817805892592,Action,Adventure,Drama
The Matrix,|Thomas A. Anderson is a man living two lives. By day he is an average computer programmer and by night a malevolent hacker known as Neo, who finds himself targeted by the police when he is contacted by Morpheus, a legendary computer hacker, who reveals the shocking truth about our reality.|,/gynBNzwyaHKtXqlEKKLioNkjKgN.jpg,1999-03-30,3.85909958863962,Action,Adventure,Science Fiction,Thriller
Battle: Los Angeles,|The Earth is attacked by unknown forces. As people everywhere watch the world's great cities fall, Los Angeles becomes the last stand for mankind in a battle no one expected. It's up to a Marine staff sergeant and his new platoon to draw a line in the sand as they take on an enemy unlike any they've ever encountered before.|,/pRVPNau3MIqyGn3QQI86pd2Pq1Y.jpg,2011-03-08,3.85885156215862,Action,Science Fiction
Watchmen,|In a gritty and alternate 1985 the glory days of costumed vigilantes have been brought to a close by a government crackdown, but after one of the masked veterans is brutally murdered an investigation into the killer is initiated. The reunited heroes set out to prevent their own destruction, but in doing so uncover a sinister plot that puts all of humanity in grave danger.|,/jXggcKzlyxj7yMBUIsqwiaaEtD5.jpg,2009-03-05,3.84132177155557,Action,Adventure,Mystery,Science Fiction,Thriller
Django Unchained,|With the help of a German bounty hunter, a freed slave sets out to rescue his wife from a brutal Mississippi plantation owner.|,/5WJnxuw41sddupf8cwOxYftuvJG.jpg,2012-12-25,3.28068315543132,Drama,Western
Autómata,|Jacq Vaucan, an insurance agent of ROC robotics corporation, routinely investigates the case of manipulating a robot. What he discovers will have profound consequences for the future of humanity.|,/wwo81W8PxHREEprnrJRww471hWm.jpg,2014-10-09,3.80585281823769,Science Fiction,Thriller
Catwoman,|Liquidated after discovering a corporate conspiracy, mild-mannered graphic artist Patience Phillips washes up on an island, where she's resurrected and endowed with the prowess of a cat -- and she's eager to use her new skills ... as a vigilante. Before you can say "cat and mouse," handsome gumshoe Tom Lone is on her tail.|,/3E1XPZ2lZmL4lJV1KSUi1jaSx3w.jpg,2004-07-23,3.80052918301671,Action,Crime
Before I Go to Sleep,|A woman wakes up every day, remembering nothing as a result of a traumatic accident in her past. One day, new terrifying truths emerge that force her to question everyone around her.|,/3UG2Pb122c7Va8MBtr1OHRB1YPh.jpg,2014-10-31,3.79504275605908,Mystery,Thriller
Se7en,|Two homicide detectives are on a desperate hunt for a serial killer whose crimes are based on the "seven deadly sins" in this dark and haunting film that takes viewers from the tortured remains of one victim to the next. The seasoned Det. Sommerset researches each sin in an effort to get inside the killer's mind, while his novice partner, Mills, scoffs at his efforts to unravel the case.|,/zgB9CCTDlXRv50Z70ZI4elJtNEk.jpg,1995-09-22,3.78502454234338,Crime,Mystery,Thriller
Jurassic World,|Twenty-two years after the events of Jurassic Park, Isla Nublar now features a fully functioning dinosaur theme park, Jurassic World, as originally envisioned by John Hammond.|,/ce9vGDMexoihZ8ta3Zt60k4FChb.jpg,2015-06-12,3.74391899779983,Action,Adventure,Science Fiction,Thriller
Avatar,|In the 22nd century, a paraplegic Marine is dispatched to the moon Pandora on a unique mission, but becomes torn between following orders and protecting an alien civilization.|,/8Ic8rRVoVrDJJlXzVzGxAesufUV.jpg,2009-12-18,4.15091912296314,Action,Adventure,Fantasy,Science Fiction
All the President's Men,|In the run-up to the 1972 elections, Washington Post reporter Bob Woodward covers what seems to be a minor break-in at the Democratic Party National headquarters. He is surprised to find top lawyers already on the defense case, and the discovery of names and addresses of Republican fund organizers on the accused further arouses his suspicions. The editor of the Post is prepared to run with the story and assigns Woodward and Carl Bernstein to it. They find the trail leading higher and higher in the Republican Party, and eventually into the White House itself.|,/jh4aA8tryNy1QDiQzkE1kzPqkwc.jpg,1976-04-04,3.72355952850538,Drama,History,Mystery,Thriller
Jurassic City,|When a top-secret laboratory is unexpectedly breached, thousands of rampaging raptors are unleashed on Los Angeles! A black-ops unit is mobilized to contain the creatures before they cause city-wide chaos. Simultaneously, a truckload of raptors is rerouted to a nearby prison. Upon their escape, these ferocious flesh-eaters are beyond containment. This is Jurassic judgment night for smoking hot sorority girls, sinister scientists, muscle-bound military and doomed death-row inmates! It's about to get bloody in Jurassic City!|,/lZYWloiaiYTp99OaLXr9u2HnOya.jpg,2015-01-09,3.67395300464302,Action,Science Fiction
Skyfall,|When Bond's latest assignment goes gravely wrong and agents around the world are exposed, MI6 is attacked forcing M to relocate the agency. These events cause her authority and position to be challenged by Gareth Mallory (Ralph Fiennes), the new Chairman of the Intelligence and Security Committee. With MI6 now compromised from both inside and out, M is left with one ally she can trust: Bond. 007 takes to the shadows - aided only by field agent, Eve (Naomie Harris) - following a trail to the mysterious Silva (Javier Bardem), whose lethal and hidden motives have yet to reveal themselves.|,/5TfNI5vvFoLGxgejWIym4lDP7uJ.jpg,2012-11-10,3.62267154171366,Action,Adventure,Thriller
The Dark Knight Rises,|Following the death of District Attorney Harvey Dent, Batman assumes responsibility for Dent's crimes to protect the late attorney's reputation and is subsequently hunted by the Gotham City Police Department. Eight years later, Batman encounters the mysterious Selina Kyle and the villainous Bane, a new terrorist leader who overwhelms Gotham's finest. The Dark Knight resurfaces to protect a city that has branded him an enemy.|,/dEYnvnUfXrqvqeRSqvIEtmzhoA8.jpg,2012-07-20,3.5916874572841,Action,Crime,Drama,Thriller
E.T. the Extra-Terrestrial,A science fiction fairytale about an extra-terrestrial who is left behind on Earth and is found by a young boy who befriends him. This heart-warming fantasy from Director Steven Spielberg became one of the most commercially successful films of all time.,/hrO4FIo4zSyYo9uv6AXenOoZIUf.jpg,1982-06-11,3.56518317140557,Adventure,Fantasy,Science Fiction,Family
Batman Begins,|Driven by tragedy, billionaire Bruce Wayne dedicates his life to uncovering and defeating the corruption that plagues his home, Gotham City.  Unable to work within the system, he instead creates a new identity, a symbol of fear for the criminal underworld - The Batman.|,/xiosOeLfzPbfLfqui41kSWnO0sZ.jpg,2005-06-15,3.51368820752033,Action,Crime,Drama
RoboCop,|In RoboCop, the year is 2028 and multinational conglomerate OmniCorp is at the center of robot technology.  Overseas, their drones have been used by the military for years, but have been forbidden for law enforcement in America.  Now OmniCorp wants to bring their controversial technology to the home front, and they see a golden opportunity to do it.  When Alex Murphy (Joel Kinnaman) – a loving husband, father and good cop doing his best to stem the tide of crime and corruption in Detroit – is critically injured, OmniCorp sees their chance to build a part-man, part-robot police officer.  OmniCorp envisions a RoboCop in every city and even more billions for their shareholders, but they never counted on one thing: there is still a man inside the machine.|,/hFQcC5eSSHqJfk70RdgrMMxGuYt.jpg,2014-02-07,3.49856706056952,Action,Crime,Science Fiction,Thriller
Jurassic Park,|A wealthy entrepreneur secretly creates a theme park featuring living dinosaurs drawn from prehistoric DNA. Before opening day, he invites a team of experts and his two eager grandchildren to experience the park and help calm anxious investors. However, the park is anything but amusing as the security systems go off-line and the dinosaurs escape.|,/c414cDeQ9b6qLPLeKmiJuLDUREJ.jpg,1993-06-08,3.47412601552149,Adventure,Science Fiction
Los Bandoleros,The film tells the back story about the characters and events leading up to the explosive oil truck heist in Fast &amp; Furious.,/iYe00vDJMUxSaJEydyC5n4R5Uil.jpg,2009-07-28,3.44841259407712,Action,Drama
Iron Man 3,|The brash-but-brilliant industrialist Tony Stark faces an enemy whose reach knows no bounds. When Stark finds his personal world destroyed at his enemy’s hands, he embarks on a harrowing quest to find those responsible. This journey, at every turn, will test his mettle. With his back against the wall, Stark is left to survive by his own devices, relying on his ingenuity and instincts to protect those closest to him. As he fights his way back, Stark discovers the answer to the question that has secretly haunted him: does the man make the suit or does the suit make the man?|,/1Ilv6ryHUv6rt9zIsbSEJUmmbEi.jpg,2013-05-03,3.44099056674558,Action,Adventure,Science Fiction
Dying of the Light,|Evan Lake, a veteran CIA agent, has been ordered to retire. But when his protégé uncovers evidence that Lake's nemesis, the terrorist Banir, has resurfaced, Lake goes rogue, embarking on a perilous, intercontinental mission to eliminate his sworn enemy.|,/7ghgi6cmgY4MvmpOvPMI7y7rh34.jpg,2014-12-04,3.43318513326161,Drama,Thriller
Vice,|Julian Michaels (Bruce Willis) has designed the ultimate resort: VICE, where anything goes and the customers can play out their wildest fantasies with artificial inhabitants who look, think and feel like humans. When an artificial (Ambyr Childers) becomes self-aware and escapes, she finds herself caught in the crossfire between Julian's mercenaries and a cop (Thomas Jane) who is hell-bent on shutting down Vice, and stopping the violence once and for all.|,/nGULYz1iLVAeS9dQkZZ2oNTt4s3.jpg,2015-01-16,3.76652766825073,Action,Adventure,Science Fiction,Thriller
Saving Private Ryan,|As U.S. troops storm the beaches of Normandy, three brothers lie dead on the battlefield, with a fourth trapped behind enemy lines. Ranger captain John Miller and seven men are tasked with penetrating German-held territory and bringing the boy home.|,/35CMz4t7PuUiQqt5h4u5nbrXZlF.jpg,1998-07-24,2.72629732736168,Drama,History,War
Pacific Rim,|When legions of monstrous creatures, known as Kaiju, started rising from the sea, a war began that would take millions of lives and consume humanity's resources for years on end. To combat the giant Kaiju, a special type of weapon was devised: massive robots, called Jaegers, which are controlled simultaneously by two pilots whose minds are locked in a neural bridge. But even the Jaegers are proving nearly defenseless in the face of the relentless Kaiju. On the verge of defeat, the forces defending mankind have no choice but to turn to two unlikely heroes—a washed-up former pilot (Charlie Hunnam) and an untested trainee (Rinko Kikuchi)—who are teamed to drive a legendary but seemingly obsolete Jaeger from the past. Together, they stand as mankind's last hope against the mounting apocalypse.|,/sCJEwEShZvruTpQ2a4yiX3Q9EyZ.jpg,2013-07-12,3.39562128565653,Action,Adventure,Science Fiction
Oblivion,|Jack Harper (Tom Cruise) is one of the last few drone repairmen stationed on Earth.  Part of a massive operation to extract vital resources after decades of war with a terrifying threat known as the Scavs, Jack’s mission is nearly complete.  His existence is brought crashing down when he rescues a beautiful  stranger from a downed spacecraft.  Her arrival triggers a chain of events that  forces him to question everything he knows and puts the fate of humanity in his hands.|,/hmOzkHlkGvi8x24fYpFSnXvjklv.jpg,2013-04-18,3.39372049925978,Action,Adventure,Mystery,Science Fiction
Playing It Cool,|The story of a young man disillusioned by love who meets a breathtaking young woman at a charity dinner by pretending to be a philanthropist. Turns out that she’s engaged to a guy who doesn’t like her going on dates. Challenged by the chase, and egged on by his eclectic friends, he feigns a platonic relationship in order to keep seeing her as he tries to conquer her heart|,/mBzSxaPOcq8XwXq4qkkyy8Ev9Go.jpg,2014-09-26,3.36154581268936,Comedy,Romance
Crazy Bitches,|7 girls and 1 fab gay guy plan a getaway to a remote ranch for a week of gossip and grub. They start off where they always do, old rivalries in place, extreme vanity covering great insecurities, but with a true love for each other underneath the bickering, sniping and sassing. A number of drinks into night one and a dark secret is revealed. The house they rented is the site of a mass murder of teenage girls 15 years earlier. Blood still stains the floors under replacement carpets. The killer still runs free. The girls take it for what it seems - a fun story for a rainy night by a roaring fire. But after one of them disappears and is discovered dead, the story doesn't seem so fun anymore. 1 by 1, they die, killed by their own vanity. The fun-filled week turns into a race against death. Who will make it out alive?|,/9ly9kQMRcEzqMb2rUH0CsUtn2g9.jpg,2015-02-13,3.33970403406826,Comedy,Horror
