name,description,image,release_date,popularity,tags
Big Hero 6,|The special bond that develops between plus-sized inflatable robot Baymax, and prodigy Hiro Hamada, who team up with a group of friends to form a band of high-tech heroes.|,/3zQvuSAUdC3mrx9vnSEpkFX0968.jpg,2014-11-07,36.8810799152155,Action,Adventure,Animation,Comedy,Family
Jupiter Ascending,|In a universe where human genetic material is the most precious commodity, an impoverished young Earth woman becomes the key to strategic maneuvers and internal strife within a powerful dynasty.|,/9D1A46Tkf44r6REj1mXZhHtUQXt.jpg,2015-02-06,40.0907676449629,Action,Adventure,Fantasy,Science Fiction
Birdman,|A fading actor best known for his portrayal of a popular superhero attempts to mount a comeback by appearing in a Broadway play. As opening night approaches, his attempts to become more altruistic, rebuild his career, and reconnect with friends and family prove more difficult than expected.|,/6yjQoECOKuXzQ14Bnf68WzTIotJ.jpg,2014-10-17,28.3303144498337,Comedy,Drama
Taken 3,|Ex-government operative Bryan Mills finds his life is shattered when he's falsely accused of a murder that hits close to home. As he's pursued by a savvy police inspector, Mills employs his particular set of skills to track the real killer and exact his unique brand of justice.|,/lTbbt8otsYLKRDvELMRn83wdNoW.jpg,2015-01-09,27.4363820801489,Action,Crime,Thriller
John Wick,|After the sudden death of his beloved wife, John Wick receives one last gift from her, a beagle puppy named Daisy, and a note imploring him not to forget how to love. But John's mourning is interrupted when his 1969 Boss Mustang catches the eye of sadistic thug Iosef Tarasov who breaks into his house and steals it, beating John unconscious and leaving Daisy dead. Unwittingly, they have just reawakened one of the most brutal assassins the underworld has ever seen.|,/sq2MmFv9sanl9PFMfbdaBLveSJ8.jpg,2014-10-24,18.5285887536752,Action,Thriller
Dumb and Dumber To,|20 years after the dimwits set out on their first adventure, they head out in search of one of their long lost children in the hope of gaining a new kidney.|,/Ekw3ijq9L6RiKvv5m2tPOEklHF.jpg,2014-11-14,21.6819249469665,Comedy
Whiplash,|Under the direction of a ruthless instructor, a talented young drummer begins to pursue perfection at any cost, even his humanity.|,/lIv1QinFqz4dlp5U4lQ6HaiskOZ.jpg,2014-10-10,15.1150454614689,Drama,Music
Nightcrawler,|A driven young man (Gyllenhaal) stumbles upon the underground world of L.A. freelance crime journalism.  When Lou Bloom, desperate for work, muscles into the world of L.A. crime journalism, he blurs the line between observer and participant to become the star of his own story. Aiding him in his effort is Nina, a TV-news veteran.|,/8oPY6ULFOTbAEskySNhgsUIN4fW.jpg,2014-10-31,17.5935627858122,Crime,Drama,Thriller
Fury,|Last months of World War II in April 1945. As the Allies make their final push in the European Theater, a battle-hardened U.S. Army sergeant in the 2nd Armored Division named Wardaddy commands a Sherman tank called "Fury" and its five-man crew on a deadly mission behind enemy lines. Outnumbered and outgunned, Wardaddy and his men face overwhelming odds in their heroic attempts to strike at the heart of Nazi Germany.|,/il9XWx5CbNd2KdDUwrcClEZiLkv.jpg,2014-10-23,16.4754825283497,Action,Drama,War
Gone Girl,|With his wife's disappearance having become the focus of an intense media circus, a man sees the spotlight turned on him when it's suspected that he may not be innocent.|,/gdiLTof3rbPDAmPaCf4g6op46bj.jpg,2014-10-03,17.4022478195328,Drama,Mystery,Thriller
Interstellar,Interstellar chronicles the adventures of a group of explorers who make use of a newly discovered wormhole to surpass the limitations on human space travel and conquer the vast distances involved in an interstellar voyage.,/m0UDkSPoVkmNfXFR9FN13yewy4B.jpg,2014-11-05,15.9507340181186,Drama,Science Fiction
The Hobbit: The Battle of the Five Armies,|Mere seconds after the events of "Desolation", Bilbo and Company continue to claim a mountain of treasure that was guarded long ago: But with Gandalf the Grey also facing some formidable foes of his own, the Hobbit is outmatched when the brutal army of orcs led by Azog the Defiler returns. But with other armies such as the elves and the men of Lake-Town, which are unsure to be trusted, are put to the ultimate test when Smaug's wrath, Azog's sheer strength, and Sauron's force of complete ends attack. All in all, the trusted armies have two choices: unite or die. But even worse, Bilbo gets put on a knife edge and finds himself fighting with Hobbit warfare with all of his might for his dwarf-friends, as the hope for Middle-Earth is all put in Bilbo's hands. The one "precious" thing to end it all.|,/vgAHvS0bT3fpcpnJqT6uDTUsHTo.jpg,2014-12-17,17.6463161513918,Adventure,Fantasy
The Interview,|Dave Skylark is king of the celebrity interview and host of the hit night time talk show "Skylark Tonight."  The brain behind Dave's empire is his producer and best friend, Aaron Rapoport. Unfulfilled, Aaron yearns to do meaningful work.  He scores the chance of a lifetime when he secures an interview for Dave with Kim Jong-Un, the mysterious and ruthless dictator of a nuclear-armed North Korea.  As Dave and Aaron prepare to leave for North Korea, they are approached by the CIA and asked to assassinate Kim.  They accept the mission, becoming two of the least qualified men ever to assassinate – or interview – the most dangerous man on earth.|,/2uWb0aSm5cFmRCHP95OdA6hvTEs.jpg,2014-12-25,13.7498752210847,Action,Comedy
Guardians of the Galaxy,|Light years from Earth, 26 years after being abducted, Peter Quill finds himself the prime target of a manhunt after discovering an orb wanted by Ronan the Accuser.|,/9gm3lL8JMTTmc3W4BmNMCuRLdL8.jpg,2014-08-01,14.9826235428948,Adventure,Fantasy,Science Fiction
Horrible Bosses 2,|Dale, Kurt and Nick decide to start their own business but things don't go as planned because of a slick investor, prompting the trio to pull off a harebrained and misguided kidnapping scheme.|,/zRkLCOx7o9tjPYb9s7u6mpw8VOs.jpg,2014-11-26,22.1647654618113,Comedy
Wild Card,|When a Las Vegas bodyguard with lethal skills and a gambling problem gets in trouble with the mob, he has one last play… and it's all or nothing.|,/s5qUhHvFAZZ7Q4r5Dn3GdsfaPKI.jpg,2015-01-30,15.0775958338472,Crime,Drama,Thriller
Dracula Untold,|Vlad Tepes is a great hero, but when he learns the Sultan is preparing for battle and needs to form an army of 1,000 boys, including Vlad's son, he vows to find a way to protect his family. Vlad turns to dark forces in order to get the power to destroy his enemies and agrees to go from hero to monster as he's turned into the mythological vampire Dracula.|,/4oy4e0DP6LRwRszfx8NY8EYBj8V.jpg,2014-10-03,13.8560690836737,Action,Drama,Fantasy,Horror,War
Lucy,|A woman, accidentally caught in a dark deal, turns the tables on her captors and transforms into a merciless warrior evolved beyond human logic.|,/rwn876MeqienhOVSSjtUPnwxn0Z.jpg,2014-07-25,12.6972469970654,Action,Science Fiction
The Maze Runner,|Set in a post-apocalyptic world, young Thomas is deposited in a community of boys after his memory is erased, soon learning they're all trapped in a maze that will require him to join forces with fellow "runners" for a shot at escape.|,/coss7RgL0NH6g4fC2s5atvf3dFO.jpg,2014-09-19,9.38329463196806,Action,Mystery,Science Fiction,Thriller
The Imitation Game,|Based on the real life story of legendary cryptanalyst Alan Turing, the film portrays the nail-biting race against time by Turing and his brilliant team of code-breakers at Britain's top-secret Government Code and Cypher School at Bletchley Park, during the darkest days of World War II.|,/noUp0XOqIcmgefRnRZa1nhtRvWO.jpg,2014-11-14,12.1433338101736,Drama,History,Thriller,War
Fifty Shades of Grey,|A literature student Anastasia Steele meets a handsome, yet tormented, billionaire named Christian Grey.|,/iRAYKRj2KN0vuXGiCVsl4qPgxlZ.jpg,2015-02-13,10.7339926570761,Drama
2001: A Space Odyssey,|Humanity finds a mysterious, obviously artificial, object buried beneath the Lunar surface and, with the intelligent computer H.A.L. 9000, sets off on a quest.|,/rT9w3tzk25jA8vl7KyvzUP5gHJV.jpg,1968-04-05,9.43562341268465,Adventure,Mystery,Science Fiction
The Maze Runner,|Set in a post-apocalyptic world, young Thomas is deposited in a community of boys after his memory is erased, soon learning they're all trapped in a maze that will require him to join forces with fellow "runners" for a shot at escape.|,/coss7RgL0NH6g4fC2s5atvf3dFO.jpg,2014-09-19,9.38329463196806,Action,Mystery,Science Fiction,Thriller
The Hunger Games: Mockingjay - Part 1,Katniss Everdeen reluctantly becomes the symbol of a mass rebellion against the autocratic Capitol.,/cWERd8rgbw7bCMZlwP207HUXxym.jpg,2014-11-21,8.55845999449703,Adventure,Science Fiction,Thriller
Kingsman: The Secret Service,The Secret Service tells the story of a super-secret spy organization that recruits an unrefined but promising street kid into the agency's ultra-competitive training program just as a global threat emerges from a twisted tech genius.,/pXN5zQHdqmvpUZDPkLooGD6PnAW.jpg,2015-02-13,8.48610254166904,Action,Adventure,Comedy,Crime
Frozen,|Young princess Anna of Arendelle dreams about finding true love at her sister Elsa’s coronation. Fate takes her on a dangerous journey in an attempt to end the eternal winter that has fallen over the kingdom. She's accompanied by ice delivery man Kristoff, his reindeer Sven, and snowman Olaf. On an adventure where she will find out what friendship, courage, family, and true love really means.|,/jIjdFXKUNtdf1bwqMrhearpyjMj.jpg,2013-11-19,8.47654993086022,Adventure,Animation,Family
The Theory of Everything,A look at the relationship between the famous physicist Stephen Hawking and his wife.,/4jspr8hLLuju59bCnMiefzRW4p0.jpg,2014-11-26,10.0209153810967,Drama,Romance
Hercules,|Fourteen hundred years ago, a tormented soul walked the earth that was neither man nor god. Hercules was the powerful son of the god king Zeus, for this he received nothing but suffering his entire life. After twelve arduous labors and the loss of his family, this dark, world-weary soul turned his back on the gods finding his only solace in bloody battle. Over the years he warmed to the company of six similar souls, their only bond being their love of fighting and presence of death. These men and woman never question where they go to fight or why or whom, just how much they will be paid. Now the King of Thrace has hired these mercenaries to train his men to become the greatest army of all time. It is time for this bunch of lost souls to finally have their eyes opened to how far they have fallen when they must train an army to become as ruthless and blood thirsty as their reputation has become.|,/jEeMN83CRI7lIEffTlgzBcUZzuN.jpg,2014-07-23,8.25888370193252,Action,Adventure
X-Men: Days of Future Past,|The ultimate X-Men ensemble fights a war for the survival of the species across two time periods in X-MEN: DAYS OF FUTURE PAST. The beloved characters from the original “X-Men” film trilogy join forces with their younger selves from “X-Men: First Class,” in an epic battle that must change the past – to save our future.|,/qKkFk9HELmABpcPoc1HHZGIxQ5a.jpg,2014-05-23,8.2127318003856,Action,Adventure,Fantasy,Science Fiction
The Hunger Games: Catching Fire,|Katniss Everdeen has returned home safe after winning the 74th Annual Hunger Games along with fellow tribute Peeta Mellark. Winning means that they must turn around and leave their family and close friends, embarking on a "Victor's Tour" of the districts. Along the way Katniss senses that a rebellion is simmering, but the Capitol is still very much in control as President Snow prepares the 75th Annual Hunger Games (The Quarter Quell) - a competition that could change Panem forever.|,/tAhSyLxpaZJCr1oc2a3flvC2B7x.jpg,2013-11-22,6.81639844998274,Action,Adventure,Science Fiction,Thriller
Let's Be Cops,|It's the ultimate buddy cop movie except for one thing: they're not cops.  When two struggling pals dress as police officers for a costume party, they become neighborhood sensations.  But when these newly-minted “heroes” get tangled in a real life web of mobsters and dirty detectives, they must put their fake badges on the line.|,/8GVU8AaYpxiIS462SZgAtjh02pm.jpg,2014-08-13,6.86136913727023,Comedy
The Judge,|A successful lawyer returns to his hometown for his mother's funeral only to discover that his estranged father, the town's judge, is suspected of murder.|,/hNnecAVTBdtNXoSdhDXIPKm0SVu.jpg,2014-10-10,6.83759467780643,Drama
Captain America: The Winter Soldier,|After the cataclysmic events in New York with The Avengers, Steve Rogers, aka Captain America is living quietly in Washington, D.C. and trying to adjust to the modern world. But when a S.H.I.E.L.D. colleague comes under attack, Steve becomes embroiled in a web of intrigue that threatens to put the world at risk. Joining forces with the Black Widow, Captain America struggles to expose the ever-widening conspiracy while fighting off professional assassins sent to silence him at every turn. When the full scope of the villainous plot is revealed, Captain America and the Black Widow enlist the help of a new ally, the Falcon. However, they soon find themselves up against an unexpected and formidable enemy—the Winter Soldier.|,/pH4oeiZAh9a40tly4D0l6aAB3ms.jpg,2014-04-04,6.7824477826274,Action,Adventure,Science Fiction
Fast & Furious 6,|Since Dom (Diesel) and Brian's (Walker) Rio heist toppled a kingpin's empire and left their crew with $100 million, our heroes have scattered across the globe. But their inability to return home and living forever on the lam have left their lives incomplete. Meanwhile, Hobbs (Johnson) has been tracking an organization of lethally skilled mercenary drivers across 12 countries, whose mastermind (Evans) is aided by a ruthless second-in-command revealed to be the love Dom thought was dead, Letty (Rodriguez). The only way to stop the criminal outfit is to outmatch them at street level, so Hobbs asks Dom to assemble his elite team in London. Payment? Full pardons for all of them so they can return home and make their families whole again.|,/kBXgGUt07sLpw6rhpiYwEyOwUDa.jpg,2013-05-22,6.65068042043696,Action,Crime,Thriller
The Matrix Reloaded,|Six months after the events depicted in The Matrix, Neo has proved to be a good omen for the free humans, as more and more humans are being freed from the matrix and brought to Zion, the one and only stronghold of the Resistance.  Neo himself has discovered his superpowers including super speed, ability to see the codes of the things inside the matrix and a certain degree of pre-cognition. But a nasty piece of news hits the human resistance: 250,000 machine sentinels are digging to Zion and would reach them in 72 hours. As Zion prepares for the ultimate war, Neo, Morpheus and Trinity are advised by the Oracle to find the Keymaker who would help them reach the Source.  Meanwhile Neo's recurrent dreams depicting Trinity's death have got him worried and as if it was not enough, Agent Smith has somehow escaped deletion, has become more powerful than before and has fixed Neo as his next target.|,/ezIurBz2fdUc68d98Fp9dRf5ihv.jpg,2003-05-06,6.48859083651634,Action,Adventure,Science Fiction,Thriller
The Drop,|Bob Saginowski finds himself at the center of a robbery gone awry and entwined in an investigation that digs deep into the neighborhood's past where friends, families, and foes all work together to make a living - no matter the cost.|,/lj8AMCjWx0jU93XajzUEOUUNKZF.jpg,2014-09-12,6.30752886539295,Crime,Drama
Teenage Mutant Ninja Turtles,The city needs heroes. Darkness has settled over New York City as Shredder and his evil Foot Clan have an iron grip on everything from the police to the politicians. The future is grim until four unlikely outcast brothers rise from the sewers and discover their destiny as Teenage Mutant Ninja Turtles. The Turtles must work with fearless reporter April and her wise-cracking cameraman Vern Fenwick to save the city and unravel Shredder's diabolical plan.,/oDL2ryJ0sV2bmjgshVgJb3qzvwp.jpg,2014-08-08,7.99228676256494,Action,Adventure,Comedy,Fantasy,Science Fiction
American Sniper,|A Navy SEAL recounts his military career, which includes more than 150 confirmed kills.  U.S. Navy SEAL Chris Kyle (Bradley Cooper) takes his sole mission -- protect his comrades -- to heart and becomes one of the most lethal snipers in American history. His pinpoint accuracy not only saves countless lives but also makes him a prime target of insurgents. Despite grave danger and his struggle to be a good husband and father to his family back in the States, Kyle serves four tours of duty in Iraq. However, when he finally returns home, he finds that he cannot leave the war behind.|,/ooy5M7QXEWVpOTAZIRGMskBQbQ9.jpg,2014-12-25,6.72917071209555,Action,War
A Walk Among the Tombstones,Private investigator Matthew Scudder is hired by a drug kingpin to find out who kidnapped and murdered his wife.,/xxe77USOk2tPnq7G4cL42gf1OxQ.jpg,2014-09-19,6.15598027113208,Crime,Drama,Mystery,Thriller
The Amazing Spider-Man 2,|For Peter Parker, life is busy. Between taking out the bad guys as Spider-Man and spending time with the person he loves, Gwen Stacy, high school graduation cannot come quickly enough. Peter has not forgotten about the promise he made to Gwen’s father to protect her by staying away, but that is a promise he cannot keep. Things will change for Peter when a new villain, Electro, emerges, an old friend, Harry Osborn, returns, and Peter uncovers new clues about his past.|,/ha1FI2U5QF1L7Avb0mqxSgnXlbZ.jpg,2014-05-02,5.71242130079945,Action,Adventure,Fantasy
The Hobbit: An Unexpected Journey,|Bilbo Baggins, a hobbit enjoying his quiet life, is swept into an epic quest by Gandalf the Grey and thirteen dwarves who seek to reclaim their mountain home from Smaug, the dragon.|,/h1XjBJoWdOh8aegBoVYKgABQZSL.jpg,2012-12-14,5.58659183794551,Action,Adventure,Fantasy
How to Train Your Dragon 2,|The thrilling second chapter of the epic How To Train Your Dragon trilogy brings back the fantastical world of Hiccup and Toothless five years later. While Astrid, Snotlout and the rest of the gang are challenging each other to dragon races (the island's new favorite contact sport), the now inseparable pair journey through the skies, charting unmapped territories and exploring new worlds. When one of their adventures leads to the discovery of a secret ice cave that is home to hundreds of new wild dragons and the mysterious Dragon Rider, the two friends find themselves at the center of a battle to protect the peace.|,/Ak8fnAmoTBkXsdYULWXAZA79XB6.jpg,2014-06-13,5.44284677261428,Action,Adventure,Animation,Comedy,Fantasy,Family
Dawn of the Planet of the Apes,|A group of scientists in San Francisco struggle to stay alive in the aftermath of a plague that is wiping out humanity, while Caesar tries to maintain dominance over his community of intelligent apes.|,/2EUAUIu5lHFlkj5FRryohlH6CRO.jpg,2014-07-11,5.42667404977276,Action,Drama,Science Fiction,Thriller
Iron Man,|After escaping from kidnappers using makeshift power armor, an ultra rich inventor and weapons maker turns his creation into a force for good by using it to fight crime. But his skills are stretched to the limit when he must face the evil Iron Monger.|,/s2IG9qXfhJYxIttKyroYFBsHwzQ.jpg,2008-05-01,5.3768102070277,Action,Adventure,Science Fiction
Boyhood,|The film tells a story of a divorced couple trying to raise their young son. The story follows the boy for twelve years, from first grade at age 6 through 12th grade at age 17-18, and examines his relationship with his parents as he grows.|,/eKi4e5zXhQKs0De4xu5AAMvu376.jpg,2014-07-11,4.59617451460369,Drama
Kill the Messenger,A reporter becomes the target of a vicious smear campaign that drives him to the point of suicide after he exposes the CIA's role in arming Contra rebels in Nicaragua and importing cocaine into California. Based on the true story of journalist Gary Webb.,/aBhz1RsQ7XKrGFmwBgASnaiSLBZ.jpg,2014-10-10,7.01102739455628,Crime,Drama,Mystery,Thriller
The Expendables 3,|Barney (Stallone), Christmas (Statham) and the rest of the team comes face-to-face with Conrad Stonebanks (Gibson), who years ago co-founded The Expendables with Barney. Stonebanks subsequently became a ruthless arms trader and someone who Barney was forced to kill... or so he thought. Stonebanks, who eluded death once before, now is making it his mission to end The Expendables -- but Barney has other plans. Barney decides that he has to fight old blood with new blood, and brings in a new era of Expendables team members, recruiting individuals who are younger, faster and more tech-savvy. The latest mission becomes a clash of classic old-school style versus high-tech expertise in the Expendables' most personal battle yet.|,/fLfpaNso9leKIMp72CjvHEC7VLv.jpg,2014-08-15,5.08406894401334,Action,Adventure,Thriller
The Dark Knight,|Batman raises the stakes in his war on crime. With the help of Lt. Jim Gordon and District Attorney Harvey Dent, Batman sets out to dismantle the remaining criminal organizations that plague the streets. The partnership proves to be effective, but they soon find themselves prey to a reign of chaos unleashed by a rising criminal mastermind known to the terrified citizens of Gotham as the Joker.|,/1hRoyzDtpgMU7Dz4JF22RANzQO7.jpg,2008-07-18,5.0523600935525,Action,Crime,Drama,Thriller
Thor,|Against his father Odin's will, The Mighty Thor -a powerful but arrogant warrior god -recklessly reignites an ancient war. Thor is cast down to Earth and forced to live among humans as punishment. Once here, Thor learns what it takes to be a true hero when the most dangerous villain of his world sends the darkest forces of Asgard to invade Earth.|,/bIuOWTtyFPjsFDevqvF3QrD1aun.jpg,2011-05-06,5.00114579312788,Action,Adventure,Fantasy
St. Vincent,|A young boy whose parents just divorced finds an unlikely friend and mentor in the misanthropic, bawdy, hedonistic, war veteran who lives next door.|,/w0hzr4eQBk1X4m63fb7sOSt9Bnn.jpg,2014-10-31,5.69469676017837,Comedy
The Hobbit: The Desolation of Smaug,|The Dwarves, Bilbo and Gandalf have successfully escaped the Misty Mountains, and Bilbo has gained the One Ring. They all continue their journey to get their gold back from the Dragon, Smaug.|,/gQCiuxGsfiXH1su6lp9n0nd0UeH.jpg,2013-12-13,5.1525804023941,Adventure,Fantasy
Night at the Museum: Secret of the Tomb,|When the magic powers of The Tablet of Ahkmenrah begin to die out, Larry Daley (Ben Stiller) spans the globe, uniting favorite and new characters while embarking on an epic quest to save the magic before it is gone forever.|,/tWwASv4CU1Au1IukacdSUewDCV3.jpg,2014-12-19,4.77168932355569,Adventure,Comedy,Fantasy,Family
